Document Name,Document Title,Document Public Url
"THE KARNATAKA REGULATION OF STONE CRUSHERS ACT, 2011-ENG.pdf","THE KARNATAKA REGULATION OF STONE CRUSHERS ACT, 2011",https://storage.googleapis.com/jugalbandi/generic_qa/e62866ab-a459-498a-92f8-96efb754e9ad/THE%20KARNATAKA%20REGULATION%20OF%20STONE%20CRUSHERS%20ACT%2C%202011-ENG.pdf
23 of 1957 (E) emblem.pdf,"THE KARNATAKA ANATOMY ACT, 1957",https://storage.googleapis.com/jugalbandi/generic_qa/e62866ab-a459-498a-92f8-96efb754e9ad/23%20of%201957%20%28E%29%20emblem.pdf
"THE KARNATAKA STATE UNIVERSITIES ACT, 2000-ENG.pdf","THE KARNATAKA STATE UNIVERSITIES ACT, 2000",https://storage.googleapis.com/jugalbandi/generic_qa/e62866ab-a459-498a-92f8-96efb754e9ad/THE%20KARNATAKA%20STATE%20UNIVERSITIES%20ACT%2C%202000-ENG.pdf
01 of 1969 (E) emblem.pdf,"THE KARNATAKA AGRICULTURAL PESTS AND DISEASES ACT, 1968",https://storage.googleapis.com/jugalbandi/generic_qa/e62866ab-a459-498a-92f8-96efb754e9ad/01%20of%201969%20%28E%29%20emblem.pdf
3 of 2018 (E) emblem.pdf,"THE CHALUKYA'S HERITAGE AREA MANAGEMENT AUTHORITY ACT, 2017",https://storage.googleapis.com/jugalbandi/generic_qa/e62866ab-a459-498a-92f8-96efb754e9ad/3%20of%202018%20%28E%29%20emblem.pdf
36 of 1974 (E).pdf,"THE KARNATAKA ELECTRICITY SUPPLY UNDERTAKINGS (ACQUISITION) ACT, 1974",https://storage.googleapis.com/jugalbandi/generic_qa/e62866ab-a459-498a-92f8-96efb754e9ad/36%20of%201974%20%28E%29.pdf
"14 of 1993 (E) 25 of 2021Gram Swaraj and Panchayat Raj Act, 1993..pdf","THE KARNATAKA GRAM SWARAJ AND PANCHAYAT RAJ ACT, 1993",https://storage.googleapis.com/jugalbandi/generic_qa/e62866ab-a459-498a-92f8-96efb754e9ad/14%20of%201993%20%28E%29%2025%20of%202021Gram%20Swaraj%20and%20Panchayat%20Raj%20Act%2C%201993..pdf
25 of 2009 (E).pdf,"THE KARNATAKA RAJYA DR. GANGUBAI HANGAL SANGEETHA MATTU PRADARSHAKA KALEGALA VISHWAVIDYALAYA ACT, 2009",https://storage.googleapis.com/jugalbandi/generic_qa/e62866ab-a459-498a-92f8-96efb754e9ad/25%20of%202009%20%28E%29.pdf
"SHARANA BASAVA UNIVERSITY ACT, 2012-ENG.pdf","SHARANA BASAVA UNIVERSITY ACT, 2012",https://storage.googleapis.com/jugalbandi/generic_qa/e62866ab-a459-498a-92f8-96efb754e9ad/SHARANA%20BASAVA%20UNIVERSITY%20ACT%2C%202012-ENG.pdf
"THE KARNATAKA STATE LAW UNIVERSITY ACT, 2009-ENG.pdf","THE KARNATAKA STATE LAW UNIVERSITY ACT, 2009",https://storage.googleapis.com/jugalbandi/generic_qa/e62866ab-a459-498a-92f8-96efb754e9ad/THE%20KARNATAKA%20STATE%20LAW%20UNIVERSITY%20ACT%2C%202009-ENG.pdf
"THE KARNATAKA HEALTH CESS ACT, 1962-ENG.pdf","THE KARNATAKA HEALTH CESS ACT, 1962",https://storage.googleapis.com/jugalbandi/generic_qa/e62866ab-a459-498a-92f8-96efb754e9ad/THE%20KARNATAKA%20HEALTH%20CESS%20ACT%2C%201962-ENG.pdf
"SRI SATHYA SAI UNIVERSITY FOR HUMAN EXCELLENCE ACT, 2018-ENG.pdf","SRI SATHYA SAI UNIVERSITY FOR HUMAN EXCELLENCE ACT, 2018",https://storage.googleapis.com/jugalbandi/generic_qa/e62866ab-a459-498a-92f8-96efb754e9ad/SRI%20SATHYA%20SAI%20UNIVERSITY%20FOR%20HUMAN%20EXCELLENCE%20ACT%2C%202018-ENG.pdf
"THE KARNATAKA IRRIGATION ACT, 1965.-ENG.pdf","THE KARNATAKA IRRIGATION ACT, 1965",https://storage.googleapis.com/jugalbandi/generic_qa/e62866ab-a459-498a-92f8-96efb754e9ad/THE%20KARNATAKA%20IRRIGATION%20ACT%2C%201965.-ENG.pdf
"THE KARNATAKA RENT ACT, 1999-ENG.pdf","THE KARNATAKA RENT ACT, 1999",https://storage.googleapis.com/jugalbandi/generic_qa/e62866ab-a459-498a-92f8-96efb754e9ad/THE%20KARNATAKA%20RENT%20ACT%2C%201999-ENG.pdf
THE KARNATAKA SCHEDULED CASTES SUB-ALLOCATION AND TRIBAL...ETC 2013-ENG.pdf,"THE KARNATAKA SCHEDULED CASTES SUB-ALLOCATION AND TRIBAL SUB-ALLOCATION (PLANNING, ALLOCATION AND UTILIZATION OF FINANCIAL RESOURCES) ACT, 2013",https://storage.googleapis.com/jugalbandi/generic_qa/e62866ab-a459-498a-92f8-96efb754e9ad/THE%20KARNATAKA%20SCHEDULED%20CASTES%20SUB-ALLOCATION%20AND%20TRIBAL...ETC%202013-ENG.pdf
62of2013(E).pdf,"THE KARNATAKA CIVIL SERVICES (WATER RESOURCE SERVICE) (SPECIAL RECRUITMENT OF ASSISTANT ENGINEERS AND JUNIOR ENGINEERS) ACT, 2013",https://storage.googleapis.com/jugalbandi/generic_qa/e62866ab-a459-498a-92f8-96efb754e9ad/62of2013%28E%29.pdf
"ST. JOSEPH’S UNIVERSITY ACT, 2021-ENG.pdf","ST. JOSEPH’S UNIVERSITY ACT, 2021",https://storage.googleapis.com/jugalbandi/generic_qa/e62866ab-a459-498a-92f8-96efb754e9ad/ST.%20JOSEPH%E2%80%99S%20UNIVERSITY%20ACT%2C%202021-ENG.pdf
"37 of 201Sri Malai Mahadeswaraswamy Kshethra Development Authority Act, 2013 (E).pdf","Sri Malai Mahadeswaraswamy Kshethra Development Authority Act, 2013",https://storage.googleapis.com/jugalbandi/generic_qa/e62866ab-a459-498a-92f8-96efb754e9ad/37%20of%20201Sri%20Malai%20Mahadeswaraswamy%20Kshethra%20Development%20Authority%20Act%2C%202013%20%28E%29.pdf
35 of 1987 (E).pdf,"THE COTTON TRANSPORT (KARNATAKA AMENDMENT) ACT, 1987",https://storage.googleapis.com/jugalbandi/generic_qa/e62866ab-a459-498a-92f8-96efb754e9ad/35%20of%201987%20%28E%29.pdf
30 of 1966 (E).pdf,"THE KARNATAKA STATE CIVIL SERVICES (PREVENTION OF STRIKES) ACT, 1966",https://storage.googleapis.com/jugalbandi/generic_qa/e62866ab-a459-498a-92f8-96efb754e9ad/30%20of%201966%20%28E%29.pdf
42 of 2020 (E).pdf,"THE KARNATAKA STATE CIVIL SERVICE (REGULATION OF TRANSFER OF STAFF OF DEPARTMENT OF TECHNICAL EDUCATION) (REPEAL) ACT, 2020",https://storage.googleapis.com/jugalbandi/generic_qa/e62866ab-a459-498a-92f8-96efb754e9ad/42%20of%202020%20%28E%29.pdf
"THE KARNATAKA VILLAGE OFFICES ABOLITION ACT, 1961-ENG.pdf","THE KARNATAKA VILLAGE OFFICES ABOLITION ACT, 1961",https://storage.googleapis.com/jugalbandi/generic_qa/e62866ab-a459-498a-92f8-96efb754e9ad/THE%20KARNATAKA%20VILLAGE%20OFFICES%20ABOLITION%20ACT%2C%201961-ENG.pdf
"THE KARNATAKA SALES TAX ACT, 1957-ENG.pdf","THE KARNATAKA SALES TAX ACT, 1957",https://storage.googleapis.com/jugalbandi/generic_qa/e62866ab-a459-498a-92f8-96efb754e9ad/THE%20KARNATAKA%20SALES%20TAX%20ACT%2C%201957-ENG.pdf
11of1959(E).pdf,"THE KARNATAKA CO-OPERATIVE SOCIETIES ACT, 1959",https://storage.googleapis.com/jugalbandi/generic_qa/e62866ab-a459-498a-92f8-96efb754e9ad/11of1959%28E%29.pdf
"THE KARNATAKA REPEALING OF CERTAIN ENACTMENTS ACT, 2017-ENG.pdf","THE KARNATAKA REPEALING OF CERTAIN ENACTMENTS ACT, 2017",https://storage.googleapis.com/jugalbandi/generic_qa/e62866ab-a459-498a-92f8-96efb754e9ad/THE%20KARNATAKA%20REPEALING%20OF%20CERTAIN%20ENACTMENTS%20ACT%2C%202017-ENG.pdf
"THE RAJIV GANDHI UNIVERSITY OF HEALTH SCIENCES ACT, 1994-ENG.pdf","THE RAJIV GANDHI UNIVERSITY OF HEALTH SCIENCES ACT, 1994",https://storage.googleapis.com/jugalbandi/generic_qa/e62866ab-a459-498a-92f8-96efb754e9ad/THE%20RAJIV%20GANDHI%20UNIVERSITY%20OF%20HEALTH%20SCIENCES%20ACT%2C%201994-ENG.pdf
"THE KARNATAKA TAX ON PROFESSIONS, TRADES, CALLINGS AND...ETC 1976-ENG.pdf","THE KARNATAKA TAX ON PROFESSIONS, TRADES, CALLINGS AND EMPLOYMENT ACT, 1976",https://storage.googleapis.com/jugalbandi/generic_qa/e62866ab-a459-498a-92f8-96efb754e9ad/THE%20KARNATAKA%20TAX%20ON%20PROFESSIONS%2C%20TRADES%2C%20CALLINGS%20AND...ETC%201976-ENG.pdf
1 of 2002 (E).pdf,"THE KARNATAKA CONTROL OF ORGANISED CRIME ACT, 2000",https://storage.googleapis.com/jugalbandi/generic_qa/e62866ab-a459-498a-92f8-96efb754e9ad/1%20of%202002%20%28E%29.pdf
38 of 1994 (E) emblem.pdf,"THE BAYALUSEEME DEVELOPMENT BOARD ACT, 1994",https://storage.googleapis.com/jugalbandi/generic_qa/e62866ab-a459-498a-92f8-96efb754e9ad/38%20of%201994%20%28E%29%20emblem.pdf
"THE KARNATAKA PROFESSIONAL EDUCATIONAL INSTITUTIONS (REGULATION OF ADMISSION AND FIXATION OF FEE) (SPECIAL PROVISIONS)  ACT, 2011-ENG.pdf","THE KARNATAKA PROFESSIONAL EDUCATIONAL INSTITUTIONS (REGULATION OF ADMISSION AND FIXATION OF FEE) (SPECIAL PROVISIONS) ACT, 2011",https://storage.googleapis.com/jugalbandi/generic_qa/e62866ab-a459-498a-92f8-96efb754e9ad/THE%20KARNATAKA%20PROFESSIONAL%20EDUCATIONAL%20INSTITUTIONS%20%28REGULATION%20OF%20ADMISSION%20AND%20FIXATION%20OF%20FEE%29%20%28SPECIAL%20PROVISIONS%29%20%20ACT%2C%202011-ENG.pdf
"THE KARNATAKA KHADI AND VILLAGE INDUSTRIES ACT, 1956.-ENG.pdf","THE KARNATAKA KHADI AND VILLAGE INDUSTRIES ACT, 1956",https://storage.googleapis.com/jugalbandi/generic_qa/e62866ab-a459-498a-92f8-96efb754e9ad/THE%20KARNATAKA%20KHADI%20AND%20VILLAGE%20INDUSTRIES%20ACT%2C%201956.-ENG.pdf
"THE KARNATAKA TOURISM TRADE (FACILITATION AND REGULATION) ACT, 2015-ENG.pdf","THE KARNATAKA TOURISM TRADE (FACILITATION AND REGULATION) ACT, 2015",https://storage.googleapis.com/jugalbandi/generic_qa/e62866ab-a459-498a-92f8-96efb754e9ad/THE%20KARNATAKA%20TOURISM%20TRADE%20%28FACILITATION%20AND%20REGULATION%29%20ACT%2C%202015-ENG.pdf
"THE KARNATAKA PRIVATE MEDICAL ESTABLISHMENTS ACT, 2007-ENG.pdf","THE KARNATAKA PRIVATE MEDICAL ESTABLISHMENTS ACT, 2007",https://storage.googleapis.com/jugalbandi/generic_qa/e62866ab-a459-498a-92f8-96efb754e9ad/THE%20KARNATAKA%20PRIVATE%20MEDICAL%20ESTABLISHMENTS%20ACT%2C%202007-ENG.pdf
"THE KAGINELE DEVELOPMENT AUTHORITY ACT, 2009-ENG.pdf","THE KAGINELE DEVELOPMENT AUTHORITY ACT, 2009",https://storage.googleapis.com/jugalbandi/generic_qa/e62866ab-a459-498a-92f8-96efb754e9ad/THE%20KAGINELE%20DEVELOPMENT%20AUTHORITY%20ACT%2C%202009-ENG.pdf
36 of 1998 (E).pdf,"THE CODE OF CIVIL PROCEDURE (KARNATAKA AMENDMENT) ACT, 1995",https://storage.googleapis.com/jugalbandi/generic_qa/e62866ab-a459-498a-92f8-96efb754e9ad/36%20of%201998%20%28E%29.pdf
A1860-45 (E).pdf,THE INDIAN PENAL CODE,https://storage.googleapis.com/jugalbandi/generic_qa/e62866ab-a459-498a-92f8-96efb754e9ad/A1860-45%20%28E%29.pdf
"THE KARNATAKA LEGISLATURE SALARIES, PENSIONS AND ALLOWANCES ACT, 1956 -ENG.pdf","THE KARNATAKA LEGISLATURE SALARIES, PENSIONS AND ALLOWANCES ACT, 1956",https://storage.googleapis.com/jugalbandi/generic_qa/e62866ab-a459-498a-92f8-96efb754e9ad/THE%20KARNATAKA%20LEGISLATURE%20SALARIES%2C%20PENSIONS%20AND%20ALLOWANCES%20ACT%2C%201956%20-ENG.pdf
"THE REVA UNIVERSITY ACT, 2012-ENG.pdf","THE REVA UNIVERSITY ACT, 2012",https://storage.googleapis.com/jugalbandi/generic_qa/e62866ab-a459-498a-92f8-96efb754e9ad/THE%20REVA%20UNIVERSITY%20ACT%2C%202012-ENG.pdf
"THE KRANTIVEERA SANGOLLI RAYANNA KSHETRA DEVELOPMENT AUTHORITY ACT, 2016-ENG.pdf","THE KRANTIVEERA SANGOLLI RAYANNA KSHETRA DEVELOPMENT AUTHORITY ACT, 2016",https://storage.googleapis.com/jugalbandi/generic_qa/e62866ab-a459-498a-92f8-96efb754e9ad/THE%20KRANTIVEERA%20SANGOLLI%20RAYANNA%20KSHETRA%20DEVELOPMENT%20AUTHORITY%20ACT%2C%202016-ENG.pdf
"VELLORE INSTITUTE OF TECHNOLOGY BANGALORE ACT, 2012-ENG.pdf","VELLORE INSTITUTE OF TECHNOLOGY BANGALORE ACT, 2012",https://storage.googleapis.com/jugalbandi/generic_qa/e62866ab-a459-498a-92f8-96efb754e9ad/VELLORE%20INSTITUTE%20OF%20TECHNOLOGY%20BANGALORE%20ACT%2C%202012-ENG.pdf
"16 of 2002(E)Fiscal Responsibility Act, 2002 (16 of 2002)-Amended by Act 6 of 2009, 14 of 2009, 13 of 2011, 17 of 2014 , 21 of 2020 and 15 of 2021.pdf","THE KARNATAKA FISCAL RESPONSIBILITY ACT, 2002",https://storage.googleapis.com/jugalbandi/generic_qa/e62866ab-a459-498a-92f8-96efb754e9ad/16%20of%202002%28E%29Fiscal%20Responsibility%20Act%2C%202002%20%2816%20of%202002%29-Amended%20by%20Act%206%20of%202009%2C%2014%20of%202009%2C%2013%20of%202011%2C%2017%20of%202014%20%2C%2021%20of%202020%20and%2015%20of%202021.pdf
"THE KARNATAKA STATE ROAD SAFETY AUTHORITY ACT, 2017-ENG.pdf","THE KARNATAKA STATE ROAD SAFETY AUTHORITY ACT, 2017",https://storage.googleapis.com/jugalbandi/generic_qa/e62866ab-a459-498a-92f8-96efb754e9ad/THE%20KARNATAKA%20STATE%20ROAD%20SAFETY%20AUTHORITY%20ACT%2C%202017-ENG.pdf
18 of 2013 (E) emblem.pdf,"ADICHUNCHANAGIRI UNIVERSITY ACT, 2012",https://storage.googleapis.com/jugalbandi/generic_qa/e62866ab-a459-498a-92f8-96efb754e9ad/18%20of%202013%20%28E%29%20emblem.pdf
"THE KARNATAKA KORAGAS (PROHIBITION OF AJALU PRACTICE ACT, 2000-ENG.pdf","THE KARNATAKA KORAGAS (PROHIBITION OF AJALU PRACTICE) ACT, 2000",https://storage.googleapis.com/jugalbandi/generic_qa/e62866ab-a459-498a-92f8-96efb754e9ad/THE%20KARNATAKA%20KORAGAS%20%28PROHIBITION%20OF%20AJALU%20PRACTICE%20ACT%2C%202000-ENG.pdf
"THE KARNATAKA VILLAGE DEFENCE PARTIES (REPEAL) ACT, 2004-ENG.pdf","THE KARNATAKA VILLAGE DEFENCE PARTIES (REPEAL) ACT, 2004",https://storage.googleapis.com/jugalbandi/generic_qa/e62866ab-a459-498a-92f8-96efb754e9ad/THE%20KARNATAKA%20VILLAGE%20DEFENCE%20PARTIES%20%28REPEAL%29%20ACT%2C%202004-ENG.pdf
29 of 2021 (E).pdf,"THE BANGALORE WATER SUPPLY AND SEWERAGE ACT, 1964",https://storage.googleapis.com/jugalbandi/generic_qa/e62866ab-a459-498a-92f8-96efb754e9ad/29%20of%202021%20%28E%29.pdf
25 of 2011 (E).pdf,"THE KARNATAKA GROUND WATER (REGULATION AND CONTROL OF DEVELOPMENT AND MANAGEMENT) ACT, 2011",https://storage.googleapis.com/jugalbandi/generic_qa/e62866ab-a459-498a-92f8-96efb754e9ad/25%20of%202011%20%28E%29.pdf
13 of 2005(E) emblem.pdf,"THE BASAVAKALYAN DEVELOPMENT BOARD ACT, 2005",https://storage.googleapis.com/jugalbandi/generic_qa/e62866ab-a459-498a-92f8-96efb754e9ad/13%20of%202005%28E%29%20emblem.pdf
"The Karnataka Improvement Boards Act, 1976-ENG.pdf","THE KARNATAKA IMPROVEMENT BOARDS ACT, 1976",https://storage.googleapis.com/jugalbandi/generic_qa/e62866ab-a459-498a-92f8-96efb754e9ad/The%20Karnataka%20Improvement%20Boards%20Act%2C%201976-ENG.pdf
"THE KARNATAKA MARINE FISHING (REGULATION) ACT, 1986 (E).pdf","THE KARNATAKA MARINE FISHING (REGULATION) ACT, 1986",https://storage.googleapis.com/jugalbandi/generic_qa/e62866ab-a459-498a-92f8-96efb754e9ad/THE%20KARNATAKA%20MARINE%20FISHING%20%28REGULATION%29%20ACT%2C%201986%20%28E%29.pdf
"THE KARNATAKA INLAND FISHERIES (CONSERVATION, DEVELOPMENT AND REGULATION) ACT, 1996-ENG.pdf","THE KARNATAKA INLAND FISHERIES (CONSERVATION DEVELOPMENT AND REGULATION) ACT, 1996",https://storage.googleapis.com/jugalbandi/generic_qa/e62866ab-a459-498a-92f8-96efb754e9ad/THE%20KARNATAKA%20INLAND%20FISHERIES%20%28CONSERVATION%2C%20DEVELOPMENT%20AND%20REGULATION%29%20ACT%2C%201996-ENG.pdf
"THE HINDU RELIGIOUS INSTITUTIONS AND RELIGIOUS ENDOWMENT ACT, 1997-ENG.pdf","THE HINDU RELIGIOUS INSTITUTIONS AND CHARITABLE ENDOWMENTS ACT, 1997",https://storage.googleapis.com/jugalbandi/generic_qa/e62866ab-a459-498a-92f8-96efb754e9ad/THE%20HINDU%20RELIGIOUS%20INSTITUTIONS%20AND%20RELIGIOUS%20ENDOWMENT%20ACT%2C%201997-ENG.pdf
"THE KARNATAKA HABITUAL OFFENDERS ACT, 1961-ENG.pdf","THE KARNATAKA HABITUAL OFFENDERS ACT, 1961",https://storage.googleapis.com/jugalbandi/generic_qa/e62866ab-a459-498a-92f8-96efb754e9ad/THE%20KARNATAKA%20HABITUAL%20OFFENDERS%20ACT%2C%201961-ENG.pdf
"THE KARNATAKA TREASURE TROVE ACT, 1962-ENG.pdf","THE KARNATAKA TREASURE TROVE ACT, 1962",https://storage.googleapis.com/jugalbandi/generic_qa/e62866ab-a459-498a-92f8-96efb754e9ad/THE%20KARNATAKA%20TREASURE%20TROVE%20ACT%2C%201962-ENG.pdf
28 of 1978 (E).pdf,"THE KARNATAKA CIVIL COURTS (SECOND AMENDMENT) ACT, 1978",https://storage.googleapis.com/jugalbandi/generic_qa/e62866ab-a459-498a-92f8-96efb754e9ad/28%20of%201978%20%28E%29.pdf
44 of 2013 (E) emblem.pdf,"THE ARKA UNIVERSITY ACT, 2012",https://storage.googleapis.com/jugalbandi/generic_qa/e62866ab-a459-498a-92f8-96efb754e9ad/44%20of%202013%20%28E%29%20emblem.pdf
"THE KARNATAKA RELIGIOUS STRUCTURES (PROTECTION) ACT, 2021-ENG.pdf","THE KARNATAKA RELIGIOUS STRUCTURES (PROTECTION) ACT, 2021",https://storage.googleapis.com/jugalbandi/generic_qa/e62866ab-a459-498a-92f8-96efb754e9ad/THE%20KARNATAKA%20RELIGIOUS%20STRUCTURES%20%28PROTECTION%29%20ACT%2C%202021-ENG.pdf
"HE KARNATAKA INDUSTRIAL ESTABLISHMENTS (NATIONAL FESTIVAL HOLIDAYS ACT, 1963-ENG.pdf","THE KARNATAKA INDUSTRIAL ESTABLISHMENTS (NATIONAL AND FESTIVAL HOLIDAYS) ACT, 1963",https://storage.googleapis.com/jugalbandi/generic_qa/e62866ab-a459-498a-92f8-96efb754e9ad/HE%20KARNATAKA%20INDUSTRIAL%20ESTABLISHMENTS%20%28NATIONAL%20FESTIVAL%20HOLIDAYS%20ACT%2C%201963-ENG.pdf
"THE KARNATAKA STATE CIVIL SERVICES ACT, 1978-ENG.pdf","THE KARNATAKA STATE CIVIL SERVICES ACT, 1978",https://storage.googleapis.com/jugalbandi/generic_qa/e62866ab-a459-498a-92f8-96efb754e9ad/THE%20KARNATAKA%20STATE%20CIVIL%20SERVICES%20ACT%2C%201978-ENG.pdf
"THE MALNAD AREA DEVELOPMENT BOARD ACT, 1991 (E).pdf","THE MALNAD AREA DEVELOPMENT BOARD ACT, 1991",https://storage.googleapis.com/jugalbandi/generic_qa/e62866ab-a459-498a-92f8-96efb754e9ad/THE%20MALNAD%20AREA%20DEVELOPMENT%20BOARD%20ACT%2C%201991%20%28E%29.pdf
14of1959(E).pdf,"THE KARNATAKA ELECTRICITY (TAXATION ON CONSUMPTION OR SALE) ACT, 1959",https://storage.googleapis.com/jugalbandi/generic_qa/e62866ab-a459-498a-92f8-96efb754e9ad/14of1959%28E%29.pdf
THE KARNATAKA PREVENTION AND ERADICATION OF INHUMAN EVIL PRACTICES AND...ETC 2017-ENG.pdf,"THE KARNATAKA PREVENTION AND ERADICATION OF INHUMAN EVIL PRACTICES AND BLACK MAGIC ACT, 2017",https://storage.googleapis.com/jugalbandi/generic_qa/e62866ab-a459-498a-92f8-96efb754e9ad/THE%20KARNATAKA%20PREVENTION%20AND%20ERADICATION%20OF%20INHUMAN%20EVIL%20PRACTICES%20AND...ETC%202017-ENG.pdf
21 of 2013(E) emblem.pdf,"THE AMRUTHA SINCHANA SPIRITUAL UNIVERSITY ACT, 2012",https://storage.googleapis.com/jugalbandi/generic_qa/e62866ab-a459-498a-92f8-96efb754e9ad/21%20of%202013%28E%29%20emblem.pdf
01 of 2019 (E) emblem.pdf,"THE KARNATAKA CIVIL SERVICES (PROCEDURE FOR SELECTION OF CANDIDATES DURING RECRUITMENT) ACT, 2018",https://storage.googleapis.com/jugalbandi/generic_qa/e62866ab-a459-498a-92f8-96efb754e9ad/01%20of%202019%20%28E%29%20emblem.pdf
"39 of 1964 (E)Dramatic Performances Act, 1964 (39 of 1964).pdf","THE KARNATAKA DRAMATIC PERFORMANCES ACT, 1964",https://storage.googleapis.com/jugalbandi/generic_qa/e62866ab-a459-498a-92f8-96efb754e9ad/39%20of%201964%20%28E%29Dramatic%20Performances%20Act%2C%201964%20%2839%20of%201964%29.pdf
"THE KARNATAKA PROFESSIONAL EDUCATIONAL INSTITUTIONS (REGULATION OF ADMISSION AND FIXATION OF FEE) (SPECIAL PROVISIONS)  ACT, 2014-ENG.pdf","THE KARNATAKA PROFESSIONAL EDUCATIONAL INSTITUTIONS (REGULATION OF ADMISSION AND FIXATION OF FEE) (SPECIAL PROVISIONS) ACT, 2014",https://storage.googleapis.com/jugalbandi/generic_qa/e62866ab-a459-498a-92f8-96efb754e9ad/THE%20KARNATAKA%20PROFESSIONAL%20EDUCATIONAL%20INSTITUTIONS%20%28REGULATION%20OF%20ADMISSION%20AND%20FIXATION%20OF%20FEE%29%20%28SPECIAL%20PROVISIONS%29%20%20ACT%2C%202014-ENG.pdf
34 of 2010 (E) emblem.pdf,"THE ALLIANCE UNIVERSITY ACT, 2010",https://storage.googleapis.com/jugalbandi/generic_qa/e62866ab-a459-498a-92f8-96efb754e9ad/34%20of%202010%20%28E%29%20emblem.pdf
"THE KARNATAKA HIGH COURT ACT, 1961-ENG.pdf","THE KARNATAKA HIGH COURT ACT, 1961",https://storage.googleapis.com/jugalbandi/generic_qa/e62866ab-a459-498a-92f8-96efb754e9ad/THE%20KARNATAKA%20HIGH%20COURT%20ACT%2C%201961-ENG.pdf
"THE UNIVERSITY OF TRANS-DISCIPLINARY HEALTH SCIENCES AND TECHNOLOGY ACT,2013-ENG.pdf","THE UNIVERSITY OF TRANS-DISCIPLINARY HEALTH SCIENCES AND TECHNOLOGY ACT, 2013",https://storage.googleapis.com/jugalbandi/generic_qa/e62866ab-a459-498a-92f8-96efb754e9ad/THE%20UNIVERSITY%20OF%20TRANS-DISCIPLINARY%20HEALTH%20SCIENCES%20AND%20TECHNOLOGY%20ACT%2C2013-ENG.pdf
"HE KARNATAKA WAREHOUSES ACT, 1961-ENG.pdf","THE KARNATAKA WAREHOUSES ACT, 1961",https://storage.googleapis.com/jugalbandi/generic_qa/e62866ab-a459-498a-92f8-96efb754e9ad/HE%20KARNATAKA%20WAREHOUSES%20ACT%2C%201961-ENG.pdf
17 of 1973 (E) emblem.pdf,"THE KARNATAKA APARTMENT OWNERSHIP ACT, 1972",https://storage.googleapis.com/jugalbandi/generic_qa/e62866ab-a459-498a-92f8-96efb754e9ad/17%20of%201973%20%28E%29%20emblem.pdf
"THE KARNATAKA TANK CONSERVATION AND DEVELOPMENT AUTHORITY ACT, 2014-ENG.pdf","THE KARNATAKA TANK CONSERVATION AND DEVELOPMENT AUTHORITY ACT, 2014",https://storage.googleapis.com/jugalbandi/generic_qa/e62866ab-a459-498a-92f8-96efb754e9ad/THE%20KARNATAKA%20TANK%20CONSERVATION%20AND%20DEVELOPMENT%20AUTHORITY%20ACT%2C%202014-ENG.pdf
"THE KARNATAKA GOODS AND SERVICES TAX ACT, 2017-ENG.pdf","THE KARNATAKA GOODS AND SERVICES TAX ACT, 2017",https://storage.googleapis.com/jugalbandi/generic_qa/e62866ab-a459-498a-92f8-96efb754e9ad/THE%20KARNATAKA%20GOODS%20AND%20SERVICES%20TAX%20ACT%2C%202017-ENG.pdf
26 of 1973 (E) emblem.pdf,"THE KARNATAKA (BELGAUM AND GULBARGA AREAS) RELIGIOUS AND CHARITABLE INAMS ABOLITION ACT, 1973",https://storage.googleapis.com/jugalbandi/generic_qa/e62866ab-a459-498a-92f8-96efb754e9ad/26%20of%201973%20%28E%29%20emblem.pdf
"THE KARNATAKA (REGISTRATION OF DOCUMENTS) VALIDATION ACT, 1964-ENG.pdf","THE KARNATAKA (REGISTRATION OF DOCUMENTS) VALIDATION ACT, 1964",https://storage.googleapis.com/jugalbandi/generic_qa/e62866ab-a459-498a-92f8-96efb754e9ad/THE%20KARNATAKA%20%28REGISTRATION%20OF%20DOCUMENTS%29%20VALIDATION%20ACT%2C%201964-ENG.pdf
COI (E).pdf,"THE CONSTITUTION OF INDIA [As on 9th September, 2020] 2020",https://storage.googleapis.com/jugalbandi/generic_qa/e62866ab-a459-498a-92f8-96efb754e9ad/COI%20%28E%29.pdf
"THE KARNATAKA SOUHARDA SAHAKARI ACT, 1997-ENG.pdf","THE KARNATAKA SOUHARDA SAHAKARI ACT, 1997",https://storage.googleapis.com/jugalbandi/generic_qa/e62866ab-a459-498a-92f8-96efb754e9ad/THE%20KARNATAKA%20SOUHARDA%20SAHAKARI%20ACT%2C%201997-ENG.pdf
"Sarvajna Kshetra Development Authority Act, 2020-ENG.pdf","Sarvajna Kshetra Development Authority Act, 2020",https://storage.googleapis.com/jugalbandi/generic_qa/e62866ab-a459-498a-92f8-96efb754e9ad/Sarvajna%20Kshetra%20Development%20Authority%20Act%2C%202020-ENG.pdf
"VIDYASHILP UNIVERSITYACT, 2020-ENG.pdf","VIDYASHILP UNIVERSITY ACT, 2020",https://storage.googleapis.com/jugalbandi/generic_qa/e62866ab-a459-498a-92f8-96efb754e9ad/VIDYASHILP%20UNIVERSITYACT%2C%202020-ENG.pdf
"THE KARNATAKA PUBLIC MONEYS (RECOVERY OF DUES) ACT, 1979-ENG.pdf","THE KARNATAKA PUBLIC MONEYS (RECOVERY OF DUES) ACT, 1979",https://storage.googleapis.com/jugalbandi/generic_qa/e62866ab-a459-498a-92f8-96efb754e9ad/THE%20KARNATAKA%20PUBLIC%20MONEYS%20%28RECOVERY%20OF%20DUES%29%20ACT%2C%201979-ENG.pdf
"THE KARNATAKA LIVE-STOCK IMPROVEMENT ACT, 1961-ENG.pdf","THE KARNATAKA LIVE-STOCK IMPROVEMENT ACT, 1961",https://storage.googleapis.com/jugalbandi/generic_qa/e62866ab-a459-498a-92f8-96efb754e9ad/THE%20KARNATAKA%20LIVE-STOCK%20IMPROVEMENT%20ACT%2C%201961-ENG.pdf
24 of 1964 (E) emblem.pdf,"THE KARNATAKA BORSTAL SCHOOLS ACT, 1963",https://storage.googleapis.com/jugalbandi/generic_qa/e62866ab-a459-498a-92f8-96efb754e9ad/24%20of%201964%20%28E%29%20emblem.pdf
"KANNADA UNIVERSITY ACT, 1991.-ENG.pdf","KANNADA UNIVERSITY ACT, 1991",https://storage.googleapis.com/jugalbandi/generic_qa/e62866ab-a459-498a-92f8-96efb754e9ad/KANNADA%20UNIVERSITY%20ACT%2C%201991.-ENG.pdf
"Daily wage Employees Welfare Act, 2012 (19 of 2013)(E).pdf","THE KARNATAKA DAILY WAGE EMPLOYEES WELFARE ACT, 2012",https://storage.googleapis.com/jugalbandi/generic_qa/e62866ab-a459-498a-92f8-96efb754e9ad/Daily%20wage%20Employees%20Welfare%20Act%2C%202012%20%2819%20of%202013%29%28E%29.pdf
"THE KARNATAKA PRISONERS ACT, 1963-ENG.pdf","THE KARNATAKA PRISONERS ACT, 1963",https://storage.googleapis.com/jugalbandi/generic_qa/e62866ab-a459-498a-92f8-96efb754e9ad/THE%20KARNATAKA%20PRISONERS%20ACT%2C%201963-ENG.pdf
12 of 1976 (E) emblem.pdf,"THE BANGALORE DEVELOPMENT AUTHORITY ACT, 1976",https://storage.googleapis.com/jugalbandi/generic_qa/e62866ab-a459-498a-92f8-96efb754e9ad/12%20of%201976%20%28E%29%20emblem.pdf
"THE KITTURU DEVELOPMENT AUTHORITY ACT, 2011-ENG.pdf","THE KITTURU DEVELOPMENT AUTHORITY ACT, 2011",https://storage.googleapis.com/jugalbandi/generic_qa/e62866ab-a459-498a-92f8-96efb754e9ad/THE%20KITTURU%20DEVELOPMENT%20AUTHORITY%20ACT%2C%202011-ENG.pdf
"THE KARNATAKA HOUSING BOARD ACT, 1962-ENG.pdf","THE KARNATAKA HOUSING BOARD ACT, 1962",https://storage.googleapis.com/jugalbandi/generic_qa/e62866ab-a459-498a-92f8-96efb754e9ad/THE%20KARNATAKA%20HOUSING%20BOARD%20ACT%2C%201962-ENG.pdf
2 of 1986 (E) emblem.pdf,"THE KARNATAKA AGRICULTURAL CREDIT PASS BOOK ACT, 1984",https://storage.googleapis.com/jugalbandi/generic_qa/e62866ab-a459-498a-92f8-96efb754e9ad/2%20of%201986%20%28E%29%20emblem.pdf
"J.S.S. SCIENCE AND TECHNOLOGY UNIVERSITY ACT, 2013-ENG.pdf","J.S.S. SCIENCE AND TECHNOLOGY UNIVERSITY ACT, 2013",https://storage.googleapis.com/jugalbandi/generic_qa/e62866ab-a459-498a-92f8-96efb754e9ad/J.S.S.%20SCIENCE%20AND%20TECHNOLOGY%20UNIVERSITY%20ACT%2C%202013-ENG.pdf
"THE KARNATAKA MARITIME BOARD ACT, 2015(E).pdf","THE KARNATAKA MARITIME BOARD ACT, 2015",https://storage.googleapis.com/jugalbandi/generic_qa/e62866ab-a459-498a-92f8-96efb754e9ad/THE%20KARNATAKA%20MARITIME%20BOARD%20ACT%2C%202015%28E%29.pdf
"THE KARNATAKA LABOUR WELFARE FUND ACT, 1965-ENG.pdf","THE KARNATAKA LABOUR WELFARE FUND ACT, 1965",https://storage.googleapis.com/jugalbandi/generic_qa/e62866ab-a459-498a-92f8-96efb754e9ad/THE%20KARNATAKA%20LABOUR%20WELFARE%20FUND%20ACT%2C%201965-ENG.pdf
"THE KARNATAKA SHOPS AND COMMERCIAL ESTABLISHMENTS ACT, 1961-ENG.pdf","THE KARNATAKA SHOPS AND COMMERCIAL ESTABLISHMENTS ACT, 1961",https://storage.googleapis.com/jugalbandi/generic_qa/e62866ab-a459-498a-92f8-96efb754e9ad/THE%20KARNATAKA%20SHOPS%20AND%20COMMERCIAL%20ESTABLISHMENTS%20ACT%2C%201961-ENG.pdf
29 of 1986 (E).pdf,"THE KARNATAKA CO-OPERATIVE TEXTILE MILLS (ACQUISITION AND TRANSFER) ACT, 1986",https://storage.googleapis.com/jugalbandi/generic_qa/e62866ab-a459-498a-92f8-96efb754e9ad/29%20of%201986%20%28E%29.pdf
THE KARNATAKA STATE RURAL DEVELOPMENT AND PANCHAYAT RAJ...ETC 2016-ENG.pdf,"THE KARNATAKA STATE RURAL DEVELOPMENT AND PANCHAYAT RAJ UNIVERSITY ACT, 2016",https://storage.googleapis.com/jugalbandi/generic_qa/e62866ab-a459-498a-92f8-96efb754e9ad/THE%20KARNATAKA%20STATE%20RURAL%20DEVELOPMENT%20AND%20PANCHAYAT%20RAJ...ETC%202016-ENG.pdf
THE KARNATAKA SLUM AREAS (DEVELOPMENT...ETC 1973-ENG.pdf,"THE KARNATAKA SLUM AREAS (DEVELOPMENT) ACT, 1973",https://storage.googleapis.com/jugalbandi/generic_qa/e62866ab-a459-498a-92f8-96efb754e9ad/THE%20KARNATAKA%20SLUM%20AREAS%20%28DEVELOPMENT...ETC%201973-ENG.pdf
"THE KARNATAKA LOCAL AUTHORITIES (OFFICIAL LANGUAGE) ACT, 1981-ENG.pdf","THE KARNATAKA LOCAL AUTHORITIES (OFFICIAL LANGUAGE) ACT, 1981",https://storage.googleapis.com/jugalbandi/generic_qa/e62866ab-a459-498a-92f8-96efb754e9ad/THE%20KARNATAKA%20LOCAL%20AUTHORITIES%20%28OFFICIAL%20LANGUAGE%29%20ACT%2C%201981-ENG.pdf
