Document Name,Document Title,Document Public Url
THE KARNATAKA PUBLIC SERVICE COMMISSION (CONDUCT OF BUSINESS AND...ETC 1959-ENG.pdf,"THE KARNATAKA PUBLIC SERVICE COMMISSION (CONDUCT OF BUSINESS AND ADDITIONAL FUNCTIONS) ACT, 1959",https://storage.googleapis.com/jugalbandi/generic_qa/e62866ab-a459-498a-92f8-96efb754e9ad/THE%20KARNATAKA%20PUBLIC%20SERVICE%20COMMISSION%20%28CONDUCT%20OF%20BUSINESS%20AND...ETC%201959-ENG.pdf
35 of 2020 (E).pdf,"THE KARNATAKA STATE CIVIL SERVICES (PROHIBITON OF ABSORPTION OF THE SERVICES OF THE EMPLOYEES OF ESTABLISHMENTS IN PUBLIC SECTOR IN TO PUBLIC SERVICE) ACT, 2020",https://storage.googleapis.com/jugalbandi/generic_qa/e62866ab-a459-498a-92f8-96efb754e9ad/35%20of%202020%20%28E%29.pdf
THE KARNATAKA PROTECTION OF INTEREST OF DEPOSITORS IN FINANCIAL...ETC 2004-ENG.pdf,"THE KARNATAKA PROTECTION OF INTEREST OF DEPOSITORS IN FINANCIAL ESTABLISHMENTS ACT, 2004",https://storage.googleapis.com/jugalbandi/generic_qa/e62866ab-a459-498a-92f8-96efb754e9ad/THE%20KARNATAKA%20PROTECTION%20OF%20INTEREST%20OF%20DEPOSITORS%20IN%20FINANCIAL...ETC%202004-ENG.pdf
"THE KARNATAKA PROHIBITION OF ADMISSION OF STUDENTS TO UN-RECOGNIZED AND UN-AFFILIATED EDUCATIONAL INSTITUTIONS ACT, 1992-ENG.pdf","THE KARNATAKA PROHIBITION OF ADMISSION OF STUDENTS TO THE UN-RECOGNISED AND UN-AFFILIATED EDUCATIONAL INSTITUTIONS ACT, 1992",https://storage.googleapis.com/jugalbandi/generic_qa/e62866ab-a459-498a-92f8-96efb754e9ad/THE%20KARNATAKA%20PROHIBITION%20OF%20ADMISSION%20OF%20STUDENTS%20TO%20UN-RECOGNIZED%20AND%20UN-AFFILIATED%20EDUCATIONAL%20INSTITUTIONS%20ACT%2C%201992-ENG.pdf
12 of 1957 (E).pdf,"THE KARNATAKA EXISTING LAWS (CONSTRUCTION OF REFERENCES TO VALUES) ACT, 1957",https://storage.googleapis.com/jugalbandi/generic_qa/e62866ab-a459-498a-92f8-96efb754e9ad/12%20of%201957%20%28E%29.pdf
"THE KARNATAKA TODDY W ORKERS' W ELFARE FUND ACT, 1981-ENG.pdf","THE KARNATAKA TODDY WORKERS' WELFARE FUND ACT, 1981",https://storage.googleapis.com/jugalbandi/generic_qa/e62866ab-a459-498a-92f8-96efb754e9ad/THE%20KARNATAKA%20TODDY%20W%20ORKERS%27%20W%20ELFARE%20FUND%20ACT%2C%201981-ENG.pdf
"THE KARNATAKA LAND REFORMS ACT, 1961-ENG.pdf","THE KARNATAKA LAND REFORMS ACT, 1961",https://storage.googleapis.com/jugalbandi/generic_qa/e62866ab-a459-498a-92f8-96efb754e9ad/THE%20KARNATAKA%20LAND%20REFORMS%20ACT%2C%201961-ENG.pdf
25 of 2015 (E).pdf,"THE KARNATAKA ESSENTIAL SERVICES MAINTENANCE ACT, 2013",https://storage.googleapis.com/jugalbandi/generic_qa/e62866ab-a459-498a-92f8-96efb754e9ad/25%20of%202015%20%28E%29.pdf
37 of 2021(E) .pdf,"THE CHANAKYA UNIVERSITY ACT, 2021 THE KARNATAKA RELIGIOUS STRUCTURES (PROTECTION) ACT, 2021",https://storage.googleapis.com/jugalbandi/generic_qa/e62866ab-a459-498a-92f8-96efb754e9ad/37%20of%202021%28E%29%20.pdf
"THE KARNATAKA IRRIGATION (LEVY OF BETTERMENT CONTRIBUTION AND WATER ETC. ACT, 1957-ENG.pdf","THE KARNATAKA IRRIGATION (LEVY OF BETTERMENT CONTRIBUTION AND WATER RATE) ACT, 1957",https://storage.googleapis.com/jugalbandi/generic_qa/e62866ab-a459-498a-92f8-96efb754e9ad/THE%20KARNATAKA%20IRRIGATION%20%28LEVY%20OF%20BETTERMENT%20CONTRIBUTION%20AND%20WATER%20ETC.%20ACT%2C%201957-ENG.pdf
"THE KARNATAKA LAND REVENUE ACT, 1964-ENG.pdf","THE KARNATAKA LAND REVENUE ACT, 1964",https://storage.googleapis.com/jugalbandi/generic_qa/e62866ab-a459-498a-92f8-96efb754e9ad/THE%20KARNATAKA%20LAND%20REVENUE%20ACT%2C%201964-ENG.pdf
19 of 1966 (E).pdf,"THE KARNATAKA CATTLE TRESPASS ACT, 1966",https://storage.googleapis.com/jugalbandi/generic_qa/e62866ab-a459-498a-92f8-96efb754e9ad/19%20of%201966%20%28E%29.pdf
"THE KARNATAKA RACE COURSES LICENSING ACT, 1952-ENG.pdf","THE KARNATAKA RACE COURSES LICENSING ACT, 1952 (KARNATAKA ACT NO.VIII OF 1952)",https://storage.googleapis.com/jugalbandi/generic_qa/e62866ab-a459-498a-92f8-96efb754e9ad/THE%20KARNATAKA%20RACE%20COURSES%20LICENSING%20ACT%2C%201952-ENG.pdf
Forest Act 1963-5 of 1964(E).pdf,"THE KARNATAKA FOREST ACT, 1963",https://storage.googleapis.com/jugalbandi/generic_qa/e62866ab-a459-498a-92f8-96efb754e9ad/Forest%20Act%201963-5%20of%201964%28E%29.pdf
"THE KARNATAKA PROHIBITION OF SMOKING AND PROTECTION OF HEALTH OF NON SMOKERS ACT, 2001-ENG.pdf","THE KARNATAKA PROHIBITION OF SMOKING AND PROTECTION OF HEALTH OF NON-SMOKERS ACT, 2001",https://storage.googleapis.com/jugalbandi/generic_qa/e62866ab-a459-498a-92f8-96efb754e9ad/THE%20KARNATAKA%20PROHIBITION%20OF%20SMOKING%20AND%20PROTECTION%20OF%20HEALTH%20OF%20NON%20SMOKERS%20ACT%2C%202001-ENG.pdf
"THE KARNATAKA PRISONS ACT, 1963-ENG.pdf","THE KARNATAKA PRISONS ACT, 1963",https://storage.googleapis.com/jugalbandi/generic_qa/e62866ab-a459-498a-92f8-96efb754e9ad/THE%20KARNATAKA%20PRISONS%20ACT%2C%201963-ENG.pdf
45of2013(E).pdf,"C.M.R UNIVERSITY ACT, 2013",https://storage.googleapis.com/jugalbandi/generic_qa/e62866ab-a459-498a-92f8-96efb754e9ad/45of2013%28E%29.pdf
"THE KANNADA DEVELOPMENT AUTHORITY ACT, 1994-ENG.pdf","THE KANNADA DEVELOPMENT AUTHORITY ACT, 1994",https://storage.googleapis.com/jugalbandi/generic_qa/e62866ab-a459-498a-92f8-96efb754e9ad/THE%20KANNADA%20DEVELOPMENT%20AUTHORITY%20ACT%2C%201994-ENG.pdf
"THE KHAJA BANDANAWAZ UNIVERSITY ACT, 2018-ENG.pdf","THE KHAJA BANDANAWAZ UNIVERSITY ACT, 2018",https://storage.googleapis.com/jugalbandi/generic_qa/e62866ab-a459-498a-92f8-96efb754e9ad/THE%20KHAJA%20BANDANAWAZ%20UNIVERSITY%20ACT%2C%202018-ENG.pdf
10 of 1978 (E) emblem.pdf,"THE KARNATAKA CERTAIN INAMS ABOLITION ACT, 1977",https://storage.googleapis.com/jugalbandi/generic_qa/e62866ab-a459-498a-92f8-96efb754e9ad/10%20of%201978%20%28E%29%20emblem.pdf
"THE KARNATAKA INFORMATION TECHNOLOGY INVESTMENT REGIONS ACT, 2010-ENG.pdf","THE KARNATAKA INFORMATION TECHNOLOGY INVESTMENT REGIONS ACT, 2010",https://storage.googleapis.com/jugalbandi/generic_qa/e62866ab-a459-498a-92f8-96efb754e9ad/THE%20KARNATAKA%20INFORMATION%20TECHNOLOGY%20INVESTMENT%20REGIONS%20ACT%2C%202010-ENG.pdf
THE KARNATAKA URBAN WATER SUPPLY AND...1973 ETC-ENG.pdf,"THE KARNATAKA URBAN WATER SUPPLY AND DRAINAGE BOARD ACT, 1973",https://storage.googleapis.com/jugalbandi/generic_qa/e62866ab-a459-498a-92f8-96efb754e9ad/THE%20KARNATAKA%20URBAN%20WATER%20SUPPLY%20AND...1973%20ETC-ENG.pdf
"THE KARNATAKA SERVICE EXAMINATIONS ACT, 1976-ENG.pdf","THE KARNATAKA SERVICE EXAMINATIONS ACT, 1976",https://storage.googleapis.com/jugalbandi/generic_qa/e62866ab-a459-498a-92f8-96efb754e9ad/THE%20KARNATAKA%20SERVICE%20EXAMINATIONS%20ACT%2C%201976-ENG.pdf
19 of 1979 Rules (E) Debt.pdf,"THE KARNATAKA DEBT RELIEF RULES, 1979",https://storage.googleapis.com/jugalbandi/generic_qa/e62866ab-a459-498a-92f8-96efb754e9ad/19%20of%201979%20Rules%20%28E%29%20Debt.pdf
"THE KARNATAKA PROFESSIONAL EDUCATIONAL INSTITUTIONS (REGULATION OF ADMISSION AND DETERMINATION OF FEE) ACT, 2006-ENG.pdf","THE KARNATAKA PROFESSIONAL EDUCATIONAL INSTITUTIONS (REGULATION OF ADMISSION AND DETERMINATION OF FEE) ACT, 2006",https://storage.googleapis.com/jugalbandi/generic_qa/e62866ab-a459-498a-92f8-96efb754e9ad/THE%20KARNATAKA%20PROFESSIONAL%20EDUCATIONAL%20INSTITUTIONS%20%28REGULATION%20OF%20ADMISSION%20AND%20DETERMINATION%20OF%20FEE%29%20ACT%2C%202006-ENG.pdf
"3 of 1899 (E)General Clauses Act, 1899 (Karnataka Act III of 1899)- Amended by Acts VII of 1949.pdf","THE KARNATAKA GENERAL CLAUSES ACT, 1899",https://storage.googleapis.com/jugalbandi/generic_qa/e62866ab-a459-498a-92f8-96efb754e9ad/3%20of%201899%20%28E%29General%20Clauses%20Act%2C%201899%20%28Karnataka%20Act%20III%20of%201899%29-%20Amended%20by%20Acts%20VII%20of%201949.pdf
6 of 1980 (E).pdf,"THE KARNATAKA COMMAND AREAS DEVELOPMENT ACT, 1980",https://storage.googleapis.com/jugalbandi/generic_qa/e62866ab-a459-498a-92f8-96efb754e9ad/6%20of%201980%20%28E%29.pdf
3 of 1961 (E).pdf,"THE KARNATAKA EVACUEE INTEREST (SEPARATION) SUPPLIMENTARY ACT, 1961",https://storage.googleapis.com/jugalbandi/generic_qa/e62866ab-a459-498a-92f8-96efb754e9ad/3%20of%201961%20%28E%29.pdf
18 of 1973 (E) emblem.pdf,"THE KARNATAKA ACQUISITION OF LANDS FOR GRANT OF HOUSE SITES ACT, 1972",https://storage.googleapis.com/jugalbandi/generic_qa/e62866ab-a459-498a-92f8-96efb754e9ad/18%20of%201973%20%28E%29%20emblem.pdf
02 of 2008 (E).pdf,"THE CHIT FUNDS (KARNATAKA AMENDMENT) ACT, 2007",https://storage.googleapis.com/jugalbandi/generic_qa/e62866ab-a459-498a-92f8-96efb754e9ad/02%20of%202008%20%28E%29.pdf
41 of 2020 (E).pdf,"The Karnataka State Civil Service (Regulation Of Transfer Of Staff Of Department Of Collegiate Education) (Repeal) Act, 2020",https://storage.googleapis.com/jugalbandi/generic_qa/e62866ab-a459-498a-92f8-96efb754e9ad/41%20of%202020%20%28E%29.pdf
"THE KARNATAKA REPEALING (REGIONAL LAWS) ACT, 2011-ENG.pdf","THE KARNATAKA REPEALING (REGIONAL LAWS) ACT, 2011",https://storage.googleapis.com/jugalbandi/generic_qa/e62866ab-a459-498a-92f8-96efb754e9ad/THE%20KARNATAKA%20REPEALING%20%28REGIONAL%20LAWS%29%20ACT%2C%202011-ENG.pdf
"THE KARNATAKA TOWN AND COUNTRY PLANNING ACT, 1961-ENG,PDF.pdf","THE KARNATAKA TOWN AND COUNTRY PLANNING ACT, 1961",https://storage.googleapis.com/jugalbandi/generic_qa/e62866ab-a459-498a-92f8-96efb754e9ad/THE%20KARNATAKA%20TOWN%20AND%20COUNTRY%20PLANNING%20ACT%2C%201961-ENG%2CPDF.pdf
2 of 1996 (E) emblem.pdf,"THE BANGALORE CITY PLANNING AREA ZONAL REGULATIONS (AMENDMENT AND VALIDATION) ACT, 1996",https://storage.googleapis.com/jugalbandi/generic_qa/e62866ab-a459-498a-92f8-96efb754e9ad/2%20of%201996%20%28E%29%20emblem.pdf
"THE KARNATAKA LAND GRABBING PROHIBITION ACT, 2011- ENG.pdf","THE KARNATAKA LAND GRABBING PROHIBITION ACT, 2011",https://storage.googleapis.com/jugalbandi/generic_qa/e62866ab-a459-498a-92f8-96efb754e9ad/THE%20KARNATAKA%20LAND%20GRABBING%20PROHIBITION%20ACT%2C%202011-%20ENG.pdf
"The Dayananda Sagar University Rules, 2019(E).pdf","DAYANANDA SAGARA UNIVERSITY ACT, 2012",https://storage.googleapis.com/jugalbandi/generic_qa/e62866ab-a459-498a-92f8-96efb754e9ad/The%20Dayananda%20Sagar%20University%20Rules%2C%202019%28E%29.pdf
18 of 1996 (E) emblem.pdf,"THE BANGALORE PALACE (ACQUISITION AND TRANSFER) ACT, 1996",https://storage.googleapis.com/jugalbandi/generic_qa/e62866ab-a459-498a-92f8-96efb754e9ad/18%20of%201996%20%28E%29%20emblem.pdf
"THE KARNATAKA PROHIBITION OF BEGGARY ACT, 1975-ENG.pdf","THE KARNATAKA PROHIBITION OF BEGGARY ACT, 1975",https://storage.googleapis.com/jugalbandi/generic_qa/e62866ab-a459-498a-92f8-96efb754e9ad/THE%20KARNATAKA%20PROHIBITION%20OF%20BEGGARY%20ACT%2C%201975-ENG.pdf
"THE KARNATAKA HIGHWAYS ACT, 1964-ENG.pdf","THE KARNATAKA HIGHWAYS ACT, 1964",https://storage.googleapis.com/jugalbandi/generic_qa/e62866ab-a459-498a-92f8-96efb754e9ad/THE%20KARNATAKA%20HIGHWAYS%20ACT%2C%201964-ENG.pdf
"THE KARNATAKA LAKE CONSERVATION AND DEVELOPMENT AUTHORITY ACT, 2014-ENG.pdf","THE KARNATAKA LAKE CONSERVATION AND DEVELOPMENT AUTHORITY ACT, 2014",https://storage.googleapis.com/jugalbandi/generic_qa/e62866ab-a459-498a-92f8-96efb754e9ad/THE%20KARNATAKA%20LAKE%20CONSERVATION%20AND%20DEVELOPMENT%20AUTHORITY%20ACT%2C%202014-ENG.pdf
"THE KARNATAKA INDUSTRIAL AREAS DEVELOPMENT ACT, 1966-ENG.pdf","THE KARNATAKA INDUSTRIAL AREAS DEVELOPMENT ACT, 1966",https://storage.googleapis.com/jugalbandi/generic_qa/e62866ab-a459-498a-92f8-96efb754e9ad/THE%20KARNATAKA%20INDUSTRIAL%20AREAS%20DEVELOPMENT%20ACT%2C%201966-ENG.pdf
"THE UNIVERSITY OF VISVESVARAYA COLLEGE OF ENGINEERING ACT, 2021-ENG.pdf","THE UNIVERSITY OF VISVESVARAYA COLLEGE OF ENGINEERING ACT, 2021",https://storage.googleapis.com/jugalbandi/generic_qa/e62866ab-a459-498a-92f8-96efb754e9ad/THE%20UNIVERSITY%20OF%20VISVESVARAYA%20COLLEGE%20OF%20ENGINEERING%20ACT%2C%202021-ENG.pdf
"THE KARNATAKA SCHEDULED CASTES, SCHEDULED TRIBES AND...ETC 1994-ENG.pdf","THE KARNATAKA SCHEDULED CASTES, SCHEDULED TRIBES AND OTHER BACKWARD CLASSES (RESERVATION OF SEATS IN EDUCATIONAL INSTITUTIONS AND OF APPOINTMENT OR POSTS IN THE SERVICES UNDER THE STATE ACT, 1994",https://storage.googleapis.com/jugalbandi/generic_qa/e62866ab-a459-498a-92f8-96efb754e9ad/THE%20KARNATAKA%20SCHEDULED%20CASTES%2C%20SCHEDULED%20TRIBES%20AND...ETC%201994-ENG.pdf
"THE KARNATAKA PUBLIC SAFETY (MEASURES) ENFORCEMENT ACT, 2017-ENG.pdf","THE KARNATAKA PUBLIC SAFETY (MEASURES) ENFORCEMENT ACT, 2017",https://storage.googleapis.com/jugalbandi/generic_qa/e62866ab-a459-498a-92f8-96efb754e9ad/THE%20KARNATAKA%20PUBLIC%20SAFETY%20%28MEASURES%29%20ENFORCEMENT%20ACT%2C%202017-ENG.pdf
THE KARNATAKA STATE COMMISSION FOR THE SCHEDULED CASTES AND...ETC 2002-ENG.pdf,"THE KARNATAKA STATE COMMISSION FOR THE SCHEDULED CASTES AND THE SCHEDULED TRIBES ACT, 2002",https://storage.googleapis.com/jugalbandi/generic_qa/e62866ab-a459-498a-92f8-96efb754e9ad/THE%20KARNATAKA%20STATE%20COMMISSION%20FOR%20THE%20SCHEDULED%20CASTES%20AND...ETC%202002-ENG.pdf
18 of 1961 (E) emblem.pdf,"THE KARNATAKA ANIMAL DISEASES (CONTROL) ACT, 1961",https://storage.googleapis.com/jugalbandi/generic_qa/e62866ab-a459-498a-92f8-96efb754e9ad/18%20of%201961%20%28E%29%20emblem.pdf
44 of 2003 (E).pdf,"THE KARNATAKA GROUND WATER (REGULATION FOR PROTECTION OF SOURCES OF DRINKING WATER) ACT, 1999",https://storage.googleapis.com/jugalbandi/generic_qa/e62866ab-a459-498a-92f8-96efb754e9ad/44%20of%202003%20%28E%29.pdf
THE KARNATAKA SCHEDULED CASTES AND SCHEDULED TRIBES (PROHIBITION....ETC 1978-ENG.pdf,"THE KARNATAKA SCHEDULED CASTES AND SCHEDULED TRIBES (PROHIBITION OF TRANSFER OF CERTAIN LANDS) ACT, 1978",https://storage.googleapis.com/jugalbandi/generic_qa/e62866ab-a459-498a-92f8-96efb754e9ad/THE%20KARNATAKA%20SCHEDULED%20CASTES%20AND%20SCHEDULED%20TRIBES%20%28PROHIBITION....ETC%201978-ENG.pdf
THE KARNATAKA REPEALING OF CERTAIN ENACTMENTS AND...2020 ETC-ENG.pdf,"KARNATAKA ACT NO. 52 OF 2020 THE KARNATAKA REPEALING OF CERTAIN ENACTMENTS AND REGIONAL LAWS Act, 2020",https://storage.googleapis.com/jugalbandi/generic_qa/e62866ab-a459-498a-92f8-96efb754e9ad/THE%20KARNATAKA%20REPEALING%20OF%20CERTAIN%20ENACTMENTS%20AND...2020%20ETC-ENG.pdf
"THE KARNATAKA LAND (RESTRICTION ON TRANSFER) ACT, 1991-ENG.pdf","THE KARNATAKA LAND (RESTRICTION ON TRANSFER) ACT, 1991",https://storage.googleapis.com/jugalbandi/generic_qa/e62866ab-a459-498a-92f8-96efb754e9ad/THE%20KARNATAKA%20LAND%20%28RESTRICTION%20ON%20TRANSFER%29%20ACT%2C%201991-ENG.pdf
THE TUNGA BHADRA SUGARS (DEVI SUGARS) LIMITED (ACQUISITION AND....ETC 2001-ENG.pdf,"THE TUNGA BHADRA SUGARS (DEVI SUGARS) LIMITED (ACQUISITION AND TRANSFER OF UNDERTAKING) (REPEAL) ACT, 2001",https://storage.googleapis.com/jugalbandi/generic_qa/e62866ab-a459-498a-92f8-96efb754e9ad/THE%20TUNGA%20BHADRA%20SUGARS%20%28DEVI%20SUGARS%29%20LIMITED%20%28ACQUISITION%20AND....ETC%202001-ENG.pdf
"22 of 2015 (E)THE KANNADA LANGUAGE LEARNING ACT, 2015-ENG.pdf","THE KANNADA LANGUAGE LEARNING ACT, 2015",https://storage.googleapis.com/jugalbandi/generic_qa/e62866ab-a459-498a-92f8-96efb754e9ad/22%20of%202015%20%28E%29THE%20KANNADA%20LANGUAGE%20LEARNING%20ACT%2C%202015-ENG.pdf
"The Karnataka Selection of candidates for Admission to Medical, Dental and...ETC 2004-ENG.pdf","The Karnataka Selection of candidates for Admission to Medical, Dental and Engineering Courses (Special Provisions) Act, 2004",https://storage.googleapis.com/jugalbandi/generic_qa/e62866ab-a459-498a-92f8-96efb754e9ad/The%20Karnataka%20Selection%20of%20candidates%20for%20Admission%20to%20Medical%2C%20Dental%20and...ETC%202004-ENG.pdf
A1908-05 (E).pdf,"THE CODE OF CIVIL PROCEDURE, 1908",https://storage.googleapis.com/jugalbandi/generic_qa/e62866ab-a459-498a-92f8-96efb754e9ad/A1908-05%20%28E%29.pdf
23 of 1964 (E).pdf,"THE KARNATAKA CINEMAS (REGULATION) ACT, 1964",https://storage.googleapis.com/jugalbandi/generic_qa/e62866ab-a459-498a-92f8-96efb754e9ad/23%20of%201964%20%28E%29.pdf
"THE KARNATAKA SAMSKRITA VISHWAVIDYALAYA ACT, 2009-ENG.pdf","THE KARNATAKA SAMSKRITA VISHWAVIDYALAYA ACT, 2009",https://storage.googleapis.com/jugalbandi/generic_qa/e62866ab-a459-498a-92f8-96efb754e9ad/THE%20KARNATAKA%20SAMSKRITA%20VISHWAVIDYALAYA%20ACT%2C%202009-ENG.pdf
27 of 1987 (E).pdf,"THE CODE OF CRIMINAL PROCEDURE (KARNATAKA AMENDMENT) ACT, 1987",https://storage.googleapis.com/jugalbandi/generic_qa/e62866ab-a459-498a-92f8-96efb754e9ad/27%20of%201987%20%28E%29.pdf
"20 of 2019 (E)Dr. B. R. Ambedkar School of Economics University, Bengaluru Act, 2018(20 of 2019)- Amended by Act 05 of 2021..pdf","DR. B.R. AMBEDKAR SCHOOL OF ECONOMICS UNIVERSITY, BENGALURU ACT, 2018",https://storage.googleapis.com/jugalbandi/generic_qa/e62866ab-a459-498a-92f8-96efb754e9ad/20%20of%202019%20%28E%29Dr.%20B.%20R.%20Ambedkar%20School%20of%20Economics%20University%2C%20Bengaluru%20Act%2C%202018%2820%20of%202019%29-%20Amended%20by%20Act%2005%20of%202021..pdf
11 of 1999 (E).pdf,"THE KARNATAKA CEILING ON GOVERNMENT GUARANTEES ACT, 1999",https://storage.googleapis.com/jugalbandi/generic_qa/e62866ab-a459-498a-92f8-96efb754e9ad/11%20of%201999%20%28E%29.pdf
10 of 1976 (E) emblem.pdf,"THE KARNATAKA APPELLATE TRIBUNAL ACT, 1976",https://storage.googleapis.com/jugalbandi/generic_qa/e62866ab-a459-498a-92f8-96efb754e9ad/10%20of%201976%20%28E%29%20emblem.pdf
27 of 1966 (E) emblem.pdf,"THE KARNATAKA AGRICULTURAL PRODUCE MARKETING (REGULATION AND DEVELOPMENT) ACT, 1966",https://storage.googleapis.com/jugalbandi/generic_qa/e62866ab-a459-498a-92f8-96efb754e9ad/27%20of%201966%20%28E%29%20emblem.pdf
09 of 2017 (E) emblem.pdf,"THE KARNATAKA STATE CIVIL SERVICES (REGULATION OF TRANSFERS AND POSTINGS OF FOREST OFFICERS AND OTHER OFFICIALS) ACT, 2016",https://storage.googleapis.com/jugalbandi/generic_qa/e62866ab-a459-498a-92f8-96efb754e9ad/09%20of%202017%20%28E%29%20emblem.pdf
2 of 1985 (E) emblem.pdf,"THE KARNATAKA ADVOCATES' WELFARE FUND ACT, 1983",https://storage.googleapis.com/jugalbandi/generic_qa/e62866ab-a459-498a-92f8-96efb754e9ad/2%20of%201985%20%28E%29%20emblem.pdf
13 of 1980 (E) emblem.pdf,"THE BANGALORE CITY CIVIL COURT ACT, 1979",https://storage.googleapis.com/jugalbandi/generic_qa/e62866ab-a459-498a-92f8-96efb754e9ad/13%20of%201980%20%28E%29%20emblem.pdf
"THE KARNATAKA PRISON DEVELOPMENT BOARD ACT, 2021-ENG.pdf","THE KARNATAKA PRISON DEVELOPMENT BOARD ACT, 2021",https://storage.googleapis.com/jugalbandi/generic_qa/e62866ab-a459-498a-92f8-96efb754e9ad/THE%20KARNATAKA%20PRISON%20DEVELOPMENT%20BOARD%20ACT%2C%202021-ENG.pdf
15 of 1967 (E) emblem.pdf,"THE KARNATAKA (ABOLITION OF CASH GRANTS) ACT, 1967",https://storage.googleapis.com/jugalbandi/generic_qa/e62866ab-a459-498a-92f8-96efb754e9ad/15%20of%201967%20%28E%29%20emblem.pdf
"THE KARNATAKA STATE PUBLIC RECORDS ACT, 2010-ENG.pdf","THE KARNATAKA STATE PUBLIC RECORDS ACT, 2010",https://storage.googleapis.com/jugalbandi/generic_qa/e62866ab-a459-498a-92f8-96efb754e9ad/THE%20KARNATAKA%20STATE%20PUBLIC%20RECORDS%20ACT%2C%202010-ENG.pdf
THE KARNATAKA SUGARCANE...2013 ETC-ENG.pdf,"THE KARNATAKA SUGARCANE (REGULATION OF PURCHASE AND SUPPLY) ACT, 2013",https://storage.googleapis.com/jugalbandi/generic_qa/e62866ab-a459-498a-92f8-96efb754e9ad/THE%20KARNATAKA%20SUGARCANE...2013%20ETC-ENG.pdf
"THE KARNATAKA SAKAALA SERVICES ACT, 2011-ENG.pdf","THE KARNATAKA SAKAALA SERVICES ACT, 2011",https://storage.googleapis.com/jugalbandi/generic_qa/e62866ab-a459-498a-92f8-96efb754e9ad/THE%20KARNATAKA%20SAKAALA%20SERVICES%20ACT%2C%202011-ENG.pdf
"51 of 1976 (E)The Karnataka Power Transmission Corporation(Recovery of Dues) Act, 1976(51 of 1976) Amended by Act 27 of 2001..pdf","THE KARNATAKA POWER TRANSMISSION CORPORATION (RECOVERY OF DUES) ACT, 1976",https://storage.googleapis.com/jugalbandi/generic_qa/e62866ab-a459-498a-92f8-96efb754e9ad/51%20of%201976%20%28E%29The%20Karnataka%20Power%20Transmission%20Corporation%28Recovery%20of%20Dues%29%20Act%2C%201976%2851%20of%201976%29%20Amended%20by%20Act%2027%20of%202001..pdf
"THE KARNATAKA STATE COMMISSION FOR BACKWARD CLASSES ACT, 1995-ENG.pdf","THE KARNATAKA STATE COMMISSION FOR BACKWARD CLASSES ACT, 1995",https://storage.googleapis.com/jugalbandi/generic_qa/e62866ab-a459-498a-92f8-96efb754e9ad/THE%20KARNATAKA%20STATE%20COMMISSION%20FOR%20BACKWARD%20CLASSES%20ACT%2C%201995-ENG.pdf
"THE KARNATAKA STATE MINORITIES COMMISSION ACT, 1994 (E).pdf","THE KARNATAKA STATE MINORITIES COMMISSION ACT, 1994",https://storage.googleapis.com/jugalbandi/generic_qa/e62866ab-a459-498a-92f8-96efb754e9ad/THE%20KARNATAKA%20STATE%20MINORITIES%20COMMISSION%20ACT%2C%201994%20%28E%29.pdf
9 of 1962 (E) emblem.pdf,"THE KARNATAKA AYURVEDIC, NATUROPATHY, SIDDHA, UNANI AND YOGA PRACTITIONERS REGISTRATION AND MEDICAL PRACTITIONERS MISCELLANEOUS PROVISIONS ACT, 1961",https://storage.googleapis.com/jugalbandi/generic_qa/e62866ab-a459-498a-92f8-96efb754e9ad/9%20of%201962%20%28E%29%20emblem.pdf
22 of 2021 (E).pdf,"THE ATRIA UNIVERSITY ACT, 2020",https://storage.googleapis.com/jugalbandi/generic_qa/e62866ab-a459-498a-92f8-96efb754e9ad/22%20of%202021%20%28E%29.pdf
"THE KARNATAKA PROVISIONAL COLLECTION OF TAXES ACT, 1974-ENG.pdf","THE KARNATAKA PROVISIONAL COLLECTION OF TAXES ACT, 1974",https://storage.googleapis.com/jugalbandi/generic_qa/e62866ab-a459-498a-92f8-96efb754e9ad/THE%20KARNATAKA%20PROVISIONAL%20COLLECTION%20OF%20TAXES%20ACT%2C%201974-ENG.pdf
04 of 2017 (E) emblem.pdf,"THE KARNATAKA ALTERATION OF NAMES OF CERTAIN PLACES ACT, 2016",https://storage.googleapis.com/jugalbandi/generic_qa/e62866ab-a459-498a-92f8-96efb754e9ad/04%20of%202017%20%28E%29%20emblem.pdf
"THE KARNATAKA STATE SERVANTS (DETERMINATION OF AGE) ACT, 1974-ENG.pdf","THE KARNATAKA STATE SERVANTS (DETERMINATION OF AGE) ACT, 1974",https://storage.googleapis.com/jugalbandi/generic_qa/e62866ab-a459-498a-92f8-96efb754e9ad/THE%20KARNATAKA%20STATE%20SERVANTS%20%28DETERMINATION%20OF%20AGE%29%20ACT%2C%201974-ENG.pdf
THE KARNATAKA RESERVATION OF APPOINTMENT OR POSTS (IN THE....ETC 2000-ENG.pdf,"THE KARNATAKA RESERVATION OF APPOINTMENT OR POSTS (IN THE CIVIL SERVICES OF THE STATE) FOR RURAL CANDIDTES ACT, 2000",https://storage.googleapis.com/jugalbandi/generic_qa/e62866ab-a459-498a-92f8-96efb754e9ad/THE%20KARNATAKA%20RESERVATION%20OF%20APPOINTMENT%20OR%20POSTS%20%28IN%20THE....ETC%202000-ENG.pdf
10 of 1982 (E).pdf,"THE KARNATAKA ECONOMIC OFFENCES (INAPPLICABILITY OF LIMITATION) ACT, 1981",https://storage.googleapis.com/jugalbandi/generic_qa/e62866ab-a459-498a-92f8-96efb754e9ad/10%20of%201982%20%28E%29.pdf
11 of 1974 (E).pdf,"THE KARNATAKA STATE CIVIL SERVICES (REGULATION OF PROMOTION, PAY AND PENSION) ACT, 1973",https://storage.googleapis.com/jugalbandi/generic_qa/e62866ab-a459-498a-92f8-96efb754e9ad/11%20of%201974%20%28E%29.pdf
37 of 1984 (E).pdf,"THE KARNATAKA EDUCATIONAL INSTITUTIONS (PROHIBITION OF CAPITATION FEE) ACT, 1984",https://storage.googleapis.com/jugalbandi/generic_qa/e62866ab-a459-498a-92f8-96efb754e9ad/37%20of%201984%20%28E%29.pdf
2 of 1975 (E) emblem.pdf,"THE KARNATAKA AGRICULTURAL CREDIT OPERATIONS AND MISCELLANEOUS PROVISIONS ACT, 1974",https://storage.googleapis.com/jugalbandi/generic_qa/e62866ab-a459-498a-92f8-96efb754e9ad/2%20of%201975%20%28E%29%20emblem.pdf
"THE KARNATAKA LEGISLATURE (PROHIBITION OF SIMULTANEOUS MEMBERSHIP) ACT, 1956 - ENG.pdf","THE KARNATAKA LEGISLATURE (PROHIBITION OF SIMULTANEOUS MEMBERSHIP) ACT, 1956",https://storage.googleapis.com/jugalbandi/generic_qa/e62866ab-a459-498a-92f8-96efb754e9ad/THE%20KARNATAKA%20LEGISLATURE%20%28PROHIBITION%20OF%20SIMULTANEOUS%20MEMBERSHIP%29%20ACT%2C%201956%20-%20ENG.pdf
THE KARNATAKA URBAN DEVELOPMENT...1987 ETC-ENG.pdf,"THE KARNATAKA URBAN DEVELOPMENT AUTHORITIES ACT, 1987",https://storage.googleapis.com/jugalbandi/generic_qa/e62866ab-a459-498a-92f8-96efb754e9ad/THE%20KARNATAKA%20URBAN%20DEVELOPMENT...1987%20ETC-ENG.pdf
CONSTITUTION-JUNE-2019 (both Kan and Eng).pdf,Constitution of India (till June 2019),https://storage.googleapis.com/jugalbandi/generic_qa/cc5d8a62-8fa7-4baf-8b68-cc86d5265fa3/CONSTITUTION-JUNE-2019%20(both%20Kan%20and%20Eng).pdf
IPC (both Kan and Eng).pdf,Indian Penal Code (IPC),https://storage.googleapis.com/jugalbandi/generic_qa/cc5d8a62-8fa7-4baf-8b68-cc86d5265fa3/IPC%20%28both%20Kan%20and%20Eng%29.pdf
"THE LAND PORTS AUTHORITY OF INDIA ACT, 2010 English.pdf","The Land Ports Authority of India Act, 2010",https://storage.googleapis.com/jugalbandi/generic_qa/cc5d8a62-8fa7-4baf-8b68-cc86d5265fa3/THE%20LAND%20PORTS%20AUTHORITY%20OF%20INDIA%20ACT%2C%202010%20English.pdf
"THE LEGAL METROLOGY ACT, 2009 English.pdf","THE Legal Metrology Act, 2009",https://storage.googleapis.com/jugalbandi/generic_qa/cc5d8a62-8fa7-4baf-8b68-cc86d5265fa3/THE%20LEGAL%20METROLOGY%20ACT%2C%202009%20English.pdf
"THE PASSPORT (ENTRY INTO INDIA) ACT, 1920 English.pdf","THE Passport (Entry into India) Act, 1920",https://storage.googleapis.com/jugalbandi/generic_qa/cc5d8a62-8fa7-4baf-8b68-cc86d5265fa3/THE%20PASSPORT%20%28ENTRY%20INTO%20INDIA%29%20ACT%2C%201920%20English.pdf
"THE PREVENTION AND CONTROL OF INFECTIOUS AND CONTAGIOUS DISEASES IN ANIMALS ACT,  2009 English.pdf","THE Prevention and Control of Infectious and Contagious Diseases in Animals Act, 2009",https://storage.googleapis.com/jugalbandi/generic_qa/cc5d8a62-8fa7-4baf-8b68-cc86d5265fa3/THE%20PREVENTION%20AND%20CONTROL%20OF%20INFECTIOUS%20AND%20CONTAGIOUS%20DISEASES%20IN%20ANIMALS%20ACT%2C%20%202009%20English.pdf
The Actuaries Act 2006 English.pdf,"The Actuaries Act, 2006",https://storage.googleapis.com/jugalbandi/generic_qa/cc5d8a62-8fa7-4baf-8b68-cc86d5265fa3/The%20Actuaries%20Act%202006%20English.pdf
"The Advocates Act, 1961 English.pdf","The Advocates Act, 1961",https://storage.googleapis.com/jugalbandi/generic_qa/cc5d8a62-8fa7-4baf-8b68-cc86d5265fa3/The%20Advocates%20Act%2C%201961%20English.pdf
The Advocates Welfare Fund Act 2001 English.pdf,"The Advocates Welfare Fund Act, 2001",https://storage.googleapis.com/jugalbandi/generic_qa/cc5d8a62-8fa7-4baf-8b68-cc86d5265fa3/The%20Advocates%20Welfare%20Fund%20Act%202001%20English.pdf
"The Agricultural Produce Cess Act, 1940 (27 of 1940) Eng.doc","The Agricultural Produce Cess Act, 1940",https://storage.googleapis.com/jugalbandi/generic_qa/cc5d8a62-8fa7-4baf-8b68-cc86d5265fa3/The%20Agricultural%20Produce%20Cess%20Act%2C%201940%20%2827%20of%201940%29%20Eng.doc
