Document Name,Document Title,Document Public Url
The Agricultural and Processed food products Export Cess Act 1985 English.pdf,"The Agricultural and Processed food products Export Cess Act, 1985",https://storage.googleapis.com/jugalbandi/generic_qa/cc5d8a62-8fa7-4baf-8b68-cc86d5265fa3/The%20Agricultural%20and%20Processed%20food%20products%20Export%20Cess%20Act%201985%20English.pdf
"The Anti - Apartheid (United Nations Convention) Act, 1981 English.pdf","The Anti - Apartheid (United Nations Convention) Act, 1981",https://storage.googleapis.com/jugalbandi/generic_qa/cc5d8a62-8fa7-4baf-8b68-cc86d5265fa3/The%20Anti%20-%20Apartheid%20%28United%20Nations%20Convention%29%20Act%2C%201981%20English.pdf
"The Anti-Hijacking Act, 1982 Eng.pdf","The Anti-Hijacking Act, 1982",https://storage.googleapis.com/jugalbandi/generic_qa/cc5d8a62-8fa7-4baf-8b68-cc86d5265fa3/The%20Anti-Hijacking%20Act%2C%201982%20Eng.pdf
"The Antiquities _ Art Treasures Act,1972 (52 of 1972) English.pdf","The Antiquities and Art Treasures Act, 1972",https://storage.googleapis.com/jugalbandi/generic_qa/cc5d8a62-8fa7-4baf-8b68-cc86d5265fa3/The%20Antiquities%20_%20Art%20Treasures%20Act%2C1972%20%2852%20of%201972%29%20English.pdf
"The Architects Act, 1972 English.pdf","The Architects Act, 1972",https://storage.googleapis.com/jugalbandi/generic_qa/cc5d8a62-8fa7-4baf-8b68-cc86d5265fa3/The%20Architects%20Act%2C%201972%20English.pdf
"The Armed Forces (Special Powers) Act, 1958 English.pdf","The Armed Forces (Special Powers) Act, 1958",https://storage.googleapis.com/jugalbandi/generic_qa/cc5d8a62-8fa7-4baf-8b68-cc86d5265fa3/The%20Armed%20Forces%20%28Special%20Powers%29%20Act%2C%201958%20English.pdf
"The Army and Air force (Disposal of Private Property) Act, 1950 English.pdf","The Army and Air force (Disposal of Private Property) Act, 1950",https://storage.googleapis.com/jugalbandi/generic_qa/cc5d8a62-8fa7-4baf-8b68-cc86d5265fa3/The%20Army%20and%20Air%20force%20%28Disposal%20of%20Private%20Property%29%20Act%2C%201950%20English.pdf
"The Asiatic Society Act, 1984 English.pdf","The Asiatic Society Act, 1984",https://storage.googleapis.com/jugalbandi/generic_qa/cc5d8a62-8fa7-4baf-8b68-cc86d5265fa3/The%20Asiatic%20Society%20Act%2C%201984%20English.pdf
"The Atomic Energy Act,1962 (33 of 1962) English.pdf","The Atomic Energy Act, 1962",https://storage.googleapis.com/jugalbandi/generic_qa/cc5d8a62-8fa7-4baf-8b68-cc86d5265fa3/The%20Atomic%20Energy%20Act%2C1962%20%2833%20of%201962%29%20English.pdf
"The Bankers Books Evidence Act, 1891 Eng.pdf","The Bankers Books Evidence Act, 1891",https://storage.googleapis.com/jugalbandi/generic_qa/cc5d8a62-8fa7-4baf-8b68-cc86d5265fa3/The%20Bankers%20Books%20Evidence%20Act%2C%201891%20Eng.pdf
"The Beedi Workers Welfare Cess Act, 1976 Eng.pdf","The Beedi Workers Welfare Cess Act, 1976",https://storage.googleapis.com/jugalbandi/generic_qa/cc5d8a62-8fa7-4baf-8b68-cc86d5265fa3/The%20Beedi%20Workers%20Welfare%20Cess%20Act%2C%201976%20Eng.pdf
"The Beedi and Cigar Workers (Conditions of Employment) Act, 1966 English.pdf","The Beedi and Cigar Workers (Conditions of Employment) Act, 1966",https://storage.googleapis.com/jugalbandi/generic_qa/cc5d8a62-8fa7-4baf-8b68-cc86d5265fa3/The%20Beedi%20and%20Cigar%20Workers%20%28Conditions%20of%20Employment%29%20Act%2C%201966%20English.pdf
"The Benami Transactions (Prohibition) Act, 1988 Eng.pdf","The Benami Transactions (Prohibition) Act, 1988",https://storage.googleapis.com/jugalbandi/generic_qa/cc5d8a62-8fa7-4baf-8b68-cc86d5265fa3/The%20Benami%20Transactions%20%28Prohibition%29%20Act%2C%201988%20Eng.pdf
"The Building and other Construction Workers_s (Regulation of Employment and Conditions of Service) Act, 1996 Eng.pdf","The Building and other Construction Workers (Regulation of Employment and Conditions of Service) Act, 1996",https://storage.googleapis.com/jugalbandi/generic_qa/cc5d8a62-8fa7-4baf-8b68-cc86d5265fa3/The%20Building%20and%20other%20Construction%20Workers_s%20%28Regulation%20of%20Employment%20and%20Conditions%20of%20Service%29%20Act%2C%201996%20Eng.pdf
The Building and other Construction workers welfare cess Act 1996 English.pdf,"The Building and other Construction workers welfare cess Act, 1996",https://storage.googleapis.com/jugalbandi/generic_qa/cc5d8a62-8fa7-4baf-8b68-cc86d5265fa3/The%20Building%20and%20other%20Construction%20workers%20welfare%20cess%20Act%201996%20English.pdf
"The Cable Television Networks (Regulation) Act, 1995 English.pdf","The Cable Television Networks (Regulation) Act, 1995",https://storage.googleapis.com/jugalbandi/generic_qa/cc5d8a62-8fa7-4baf-8b68-cc86d5265fa3/The%20Cable%20Television%20Networks%20%28Regulation%29%20Act%2C%201995%20English.pdf
"The Carriage by Road Act, 2007 English.pdf","The Carriage by Road Act, 2007",https://storage.googleapis.com/jugalbandi/generic_qa/cc5d8a62-8fa7-4baf-8b68-cc86d5265fa3/The%20Carriage%20by%20Road%20Act%2C%202007%20English.pdf
"The Central Duties of Excise (Retrospective Exemption) Act, 1986 Eng.pdf","The Central Duties of Excise (Retrospective Exemption) Act, 1986",https://storage.googleapis.com/jugalbandi/generic_qa/cc5d8a62-8fa7-4baf-8b68-cc86d5265fa3/The%20Central%20Duties%20of%20Excise%20%28Retrospective%20Exemption%29%20Act%2C%201986%20Eng.pdf
"The Central Road Fund Act, 2000 Eng.pdf","The Central Road Fund Act, 2000",https://storage.googleapis.com/jugalbandi/generic_qa/cc5d8a62-8fa7-4baf-8b68-cc86d5265fa3/The%20Central%20Road%20Fund%20Act%2C%202000%20Eng.pdf
"The Charitable Endowments Act, 1890 English.pdf","The Charitable Endowments Act, 1890",https://storage.googleapis.com/jugalbandi/generic_qa/cc5d8a62-8fa7-4baf-8b68-cc86d5265fa3/The%20Charitable%20Endowments%20Act%2C%201890%20English.pdf
"The Chartered Accountants Act, 1949 English.pdf","The Chartered Accountants Act, 1949",https://storage.googleapis.com/jugalbandi/generic_qa/cc5d8a62-8fa7-4baf-8b68-cc86d5265fa3/The%20Chartered%20Accountants%20Act%2C%201949%20English.pdf
"The Chit Funds Act, 1982 Eng.pdf","The Chit Funds Act, 1982",https://storage.googleapis.com/jugalbandi/generic_qa/cc5d8a62-8fa7-4baf-8b68-cc86d5265fa3/The%20Chit%20Funds%20Act%2C%201982%20Eng.pdf
"The Cine Workers Welfare Cess Act, 1981 Eng.pdf","The Cine Workers Welfare Cess Act, 1981",https://storage.googleapis.com/jugalbandi/generic_qa/cc5d8a62-8fa7-4baf-8b68-cc86d5265fa3/The%20Cine%20Workers%20Welfare%20Cess%20Act%2C%201981%20Eng.pdf
"The Cine Workers and Cinema Theatre Workers (Regulation of Employment) Act, 1981 English.pdf","The Cine Workers and Cinema Theatre Workers (Regulation of Employment) Act, 1981",https://storage.googleapis.com/jugalbandi/generic_qa/cc5d8a62-8fa7-4baf-8b68-cc86d5265fa3/The%20Cine%20Workers%20and%20Cinema%20Theatre%20Workers%20%28Regulation%20of%20Employment%29%20Act%2C%201981%20English.pdf
"The Cine-Workers Welfare Fund Act, 1981 English.pdf","The Cine-Workers Welfare Fund Act, 1981",https://storage.googleapis.com/jugalbandi/generic_qa/cc5d8a62-8fa7-4baf-8b68-cc86d5265fa3/The%20Cine-Workers%20Welfare%20Fund%20Act%2C%201981%20English.pdf
"The Co-operative Societies Act, 1912 English.pdf","The Co-operative Societies Act, 1912",https://storage.googleapis.com/jugalbandi/generic_qa/cc5d8a62-8fa7-4baf-8b68-cc86d5265fa3/The%20Co-operative%20Societies%20Act%2C%201912%20English.pdf
"The Coal India (Regulation of Transfers and Validation) Act, 2000 English.pdf","The Coal India (Regulation of Transfers and Validation) Act, 2000",https://storage.googleapis.com/jugalbandi/generic_qa/cc5d8a62-8fa7-4baf-8b68-cc86d5265fa3/The%20Coal%20India%20%28Regulation%20of%20Transfers%20and%20Validation%29%20Act%2C%202000%20English.pdf
"The Code of Criminal Procedure, 1973-Diglot  Final English.pdf","The Code of Criminal Procedure, 1973",https://storage.googleapis.com/jugalbandi/generic_qa/cc5d8a62-8fa7-4baf-8b68-cc86d5265fa3/The%20Code%20of%20Criminal%20Procedure%2C%201973-Diglot%20%20Final%20English.pdf
"The Collection of Statistics Act, 2008 English.pdf","The Collection of Statistics Act, 2008",https://storage.googleapis.com/jugalbandi/generic_qa/cc5d8a62-8fa7-4baf-8b68-cc86d5265fa3/The%20Collection%20of%20Statistics%20Act%2C%202008%20English.pdf
The Commission for protection of child rights Act 2005 English.pdf,"The Commission for protection of child rights Act, 2005",https://storage.googleapis.com/jugalbandi/generic_qa/cc5d8a62-8fa7-4baf-8b68-cc86d5265fa3/The%20Commission%20for%20protection%20of%20child%20rights%20Act%202005%20English.pdf
"The Commission of Sati (Prevention) Act, 1987 English.pdf","The Commission of Sati (Prevention) Act, 1987",https://storage.googleapis.com/jugalbandi/generic_qa/cc5d8a62-8fa7-4baf-8b68-cc86d5265fa3/The%20Commission%20of%20Sati%20%28Prevention%29%20Act%2C%201987%20English.pdf
"The Company secretaries Act, 1980 English.pdf","The Company secretaries Act, 1980",https://storage.googleapis.com/jugalbandi/generic_qa/cc5d8a62-8fa7-4baf-8b68-cc86d5265fa3/The%20Company%20secretaries%20Act%2C%201980%20English.pdf
"The Dangerous Machines (Regulation) Act, 1983 Eng.pdf","The Dangerous Machines (Regulation) Act, 1983",https://storage.googleapis.com/jugalbandi/generic_qa/cc5d8a62-8fa7-4baf-8b68-cc86d5265fa3/The%20Dangerous%20Machines%20%28Regulation%29%20Act%2C%201983%20Eng.pdf
"The Delimitation Act, 2002 English.pdf","The Delimitation Act, 2002",https://storage.googleapis.com/jugalbandi/generic_qa/cc5d8a62-8fa7-4baf-8b68-cc86d5265fa3/The%20Delimitation%20Act%2C%202002%20English.pdf
"The Designs Act, 2000 English.pdf","The Designs Act, 2000",https://storage.googleapis.com/jugalbandi/generic_qa/cc5d8a62-8fa7-4baf-8b68-cc86d5265fa3/The%20Designs%20Act%2C%202000%20English.pdf
"The Diplomatic Relations (ViennaConvention) Act, 1972 English.pdf","The Diplomatic Relations (Vienna Convention) Act, 1972",https://storage.googleapis.com/jugalbandi/generic_qa/cc5d8a62-8fa7-4baf-8b68-cc86d5265fa3/The%20Diplomatic%20Relations%20%28ViennaConvention%29%20Act%2C%201972%20English.pdf
"The Dock Workers (Safety, Health and Welfare) Act, 1986 English.pdf","The Dock Workers (Safety, Health and Welfare) Act, 1986",https://storage.googleapis.com/jugalbandi/generic_qa/cc5d8a62-8fa7-4baf-8b68-cc86d5265fa3/The%20Dock%20Workers%20%28Safety%2C%20Health%20and%20Welfare%29%20Act%2C%201986%20English.pdf
"The Drugs and Cosmetics Act, 1940 English.pdf","The Drugs and Cosmetics Act, 1940",https://storage.googleapis.com/jugalbandi/generic_qa/cc5d8a62-8fa7-4baf-8b68-cc86d5265fa3/The%20Drugs%20and%20Cosmetics%20Act%2C%201940%20English.pdf
"The Energy Conservation Act, 2001 English.pdf","The Energy Conservation Act, 2001",https://storage.googleapis.com/jugalbandi/generic_qa/cc5d8a62-8fa7-4baf-8b68-cc86d5265fa3/The%20Energy%20Conservation%20Act%2C%202001%20English.pdf
"The Explosive Substances Act, 1908 English.pdf","The Explosive Substances Act, 1908",https://storage.googleapis.com/jugalbandi/generic_qa/cc5d8a62-8fa7-4baf-8b68-cc86d5265fa3/The%20Explosive%20Substances%20Act%2C%201908%20English.pdf
"The Export - Import Bank of IndiaAct, 1981 English.pdf","The Export - Import Bank of India Act, 1981",https://storage.googleapis.com/jugalbandi/generic_qa/cc5d8a62-8fa7-4baf-8b68-cc86d5265fa3/The%20Export%20-%20Import%20Bank%20of%20IndiaAct%2C%201981%20English.pdf
"The Extradition Act, 1962 English.pdf","The Extradition Act, 1962",https://storage.googleapis.com/jugalbandi/generic_qa/cc5d8a62-8fa7-4baf-8b68-cc86d5265fa3/The%20Extradition%20Act%2C%201962%20English.pdf
"The Factories Act, 1948 English.pdf","The Factories Act, 1948",https://storage.googleapis.com/jugalbandi/generic_qa/cc5d8a62-8fa7-4baf-8b68-cc86d5265fa3/The%20Factories%20Act%2C%201948%20English.pdf
"The Foreign Marriage Act, 1969 English.pdf","The Foreign Marriage Act, 1969",https://storage.googleapis.com/jugalbandi/generic_qa/cc5d8a62-8fa7-4baf-8b68-cc86d5265fa3/The%20Foreign%20Marriage%20Act%2C%201969%20English.pdf
"The Foreign Trade (Development and Regulation) Act, 1992 English.pdf","The Foreign Trade (Development and Regulation) Act, 1992",https://storage.googleapis.com/jugalbandi/generic_qa/cc5d8a62-8fa7-4baf-8b68-cc86d5265fa3/The%20Foreign%20Trade%20%28Development%20and%20Regulation%29%20Act%2C%201992%20English.pdf
"The Forest (Conservation) Act, 1980 English.pdf","The Forest (Conservation) Act, 1980",https://storage.googleapis.com/jugalbandi/generic_qa/cc5d8a62-8fa7-4baf-8b68-cc86d5265fa3/The%20Forest%20%28Conservation%29%20Act%2C%201980%20English.pdf
"The Government Securities Act, 2006 English.pdf","The Government Securities Act, 2006",https://storage.googleapis.com/jugalbandi/generic_qa/cc5d8a62-8fa7-4baf-8b68-cc86d5265fa3/The%20Government%20Securities%20Act%2C%202006%20English.pdf
The Grama Nyayalayagala Act 2008 Eng.pdf,"The Grama Nyayalayagala Act, 2008",https://storage.googleapis.com/jugalbandi/generic_qa/cc5d8a62-8fa7-4baf-8b68-cc86d5265fa3/The%20Grama%20Nyayalayagala%20Act%202008%20Eng.pdf
"The Haj Comittee Act, 2002 English.pdf","The Haj Committee Act, 2002",https://storage.googleapis.com/jugalbandi/generic_qa/cc5d8a62-8fa7-4baf-8b68-cc86d5265fa3/The%20Haj%20Comittee%20Act%2C%202002%20English.pdf
"The Hindu Marriage Act, 1955 English.pdf","The Hindu Marriage Act, 1955",https://storage.googleapis.com/jugalbandi/generic_qa/cc5d8a62-8fa7-4baf-8b68-cc86d5265fa3/The%20Hindu%20Marriage%20Act%2C%201955%20English.pdf
"The Hindu adoption and Maintenance Act, 1956 English.pdf","The Hindu adoption and Maintenance Act, 1956",https://storage.googleapis.com/jugalbandi/generic_qa/cc5d8a62-8fa7-4baf-8b68-cc86d5265fa3/The%20Hindu%20adoption%20and%20Maintenance%20Act%2C%201956%20English.pdf
"The Illegal Migrants (Determination by Tribunals) Act, 1983 English.pdf","The Illegal Migrants (Determination by Tribunals) Act, 1983",https://storage.googleapis.com/jugalbandi/generic_qa/cc5d8a62-8fa7-4baf-8b68-cc86d5265fa3/The%20Illegal%20Migrants%20%28Determination%20by%20Tribunals%29%20Act%2C%201983%20English.pdf
"The Immigration (Carriers Liability) Act, 2000 English.pdf","The Immigration (Carriers Liability) Act, 2000",https://storage.googleapis.com/jugalbandi/generic_qa/cc5d8a62-8fa7-4baf-8b68-cc86d5265fa3/The%20Immigration%20%28Carriers%20Liability%29%20Act%2C%202000%20English.pdf
"The Immoral Traffic (Prevention) Act, 1956 (104 of 1956) English.pdf","The Immoral Traffic (Prevention) Act, 1956",https://storage.googleapis.com/jugalbandi/generic_qa/cc5d8a62-8fa7-4baf-8b68-cc86d5265fa3/The%20Immoral%20Traffic%20%28Prevention%29%20Act%2C%201956%20%28104%20of%201956%29%20English.pdf
"The Indian Council of World affairs Act, 2001 English.pdf","The Indian Council of World affairs Act, 2001",https://storage.googleapis.com/jugalbandi/generic_qa/cc5d8a62-8fa7-4baf-8b68-cc86d5265fa3/The%20Indian%20Council%20of%20World%20affairs%20Act%2C%202001%20English.pdf
The Indian Evidence Act Full Book Final English.pdf,"The Indian Evidence Act, 1872",https://storage.googleapis.com/jugalbandi/generic_qa/cc5d8a62-8fa7-4baf-8b68-cc86d5265fa3/The%20Indian%20Evidence%20Act%20Full%20Book%20Final%20English.pdf
"The Indian Forest Act, 1927 English.pdf","The Indian Forest Act, 1927",https://storage.googleapis.com/jugalbandi/generic_qa/cc5d8a62-8fa7-4baf-8b68-cc86d5265fa3/The%20Indian%20Forest%20Act%2C%201927%20English.pdf
"The Indian Partnership Act, 1932 English.pdf","The Indian Partnership Act, 1932",https://storage.googleapis.com/jugalbandi/generic_qa/cc5d8a62-8fa7-4baf-8b68-cc86d5265fa3/The%20Indian%20Partnership%20Act%2C%201932%20English.pdf
"The Indian Securities Act, 1920 Eng.pdf","The Indian Securities Act, 1920",https://storage.googleapis.com/jugalbandi/generic_qa/cc5d8a62-8fa7-4baf-8b68-cc86d5265fa3/The%20Indian%20Securities%20Act%2C%201920%20Eng.pdf
"The Indian Stamp Act, 1899 English.pdf","The Indian Stamp Act, 1899",https://storage.googleapis.com/jugalbandi/generic_qa/cc5d8a62-8fa7-4baf-8b68-cc86d5265fa3/The%20Indian%20Stamp%20Act%2C%201899%20English.pdf
"The Indian Succession Act, 1925 English.pdf","The Indian Succession Act, 1925",https://storage.googleapis.com/jugalbandi/generic_qa/cc5d8a62-8fa7-4baf-8b68-cc86d5265fa3/The%20Indian%20Succession%20Act%2C%201925%20English.pdf
"The Indian Treasure-trove Act, 1878 English.pdf","The Indian Treasure-trove Act, 1878",https://storage.googleapis.com/jugalbandi/generic_qa/cc5d8a62-8fa7-4baf-8b68-cc86d5265fa3/The%20Indian%20Treasure-trove%20Act%2C%201878%20English.pdf
"The Indian Veterinary Council Act, 1984 English.pdf","The Indian Veterinary Council Act, 1984",https://storage.googleapis.com/jugalbandi/generic_qa/cc5d8a62-8fa7-4baf-8b68-cc86d5265fa3/The%20Indian%20Veterinary%20Council%20Act%2C%201984%20English.pdf
"The Industrial Development Bank ofIndiaAct, 1964 Eng.pdf","The Industrial Development Bank of India Act, 1964",https://storage.googleapis.com/jugalbandi/generic_qa/cc5d8a62-8fa7-4baf-8b68-cc86d5265fa3/The%20Industrial%20Development%20Bank%20ofIndiaAct%2C%201964%20Eng.pdf
"The Industrial Disputs Act, 1947 English.pdf","The Industrial Disputes Act, 1947",https://storage.googleapis.com/jugalbandi/generic_qa/cc5d8a62-8fa7-4baf-8b68-cc86d5265fa3/The%20Industrial%20Disputs%20Act%2C%201947%20English.pdf
"The Information Technology Act, 2000 English.pdf","The Information Technology Act, 2000",https://storage.googleapis.com/jugalbandi/generic_qa/cc5d8a62-8fa7-4baf-8b68-cc86d5265fa3/The%20Information%20Technology%20Act%2C%202000%20English.pdf
"The Inland Vessels Act, 1917 Eng.pdf","The Inland Vessels Act, 1917",https://storage.googleapis.com/jugalbandi/generic_qa/cc5d8a62-8fa7-4baf-8b68-cc86d5265fa3/The%20Inland%20Vessels%20Act%2C%201917%20Eng.pdf
"The Inland Waterways Authority of India Act, 1985 English.pdf","The Inland Waterways Authority of India Act, 1985",https://storage.googleapis.com/jugalbandi/generic_qa/cc5d8a62-8fa7-4baf-8b68-cc86d5265fa3/The%20Inland%20Waterways%20Authority%20of%20India%20Act%2C%201985%20English.pdf
"The Insurance Regulatory and Development Authority Act, 1999 English.pdf","The Insurance Regulatory and Development Authority Act, 1999",https://storage.googleapis.com/jugalbandi/generic_qa/cc5d8a62-8fa7-4baf-8b68-cc86d5265fa3/The%20Insurance%20Regulatory%20and%20Development%20Authority%20Act%2C%201999%20English.pdf
The Inter-state Migrant Workmen (Regulation of Employment and Cond English.pdf,"The Inter-state Migrant Workmen (Regulation of Employment and Conditions of Service) Act, 1979",https://storage.googleapis.com/jugalbandi/generic_qa/cc5d8a62-8fa7-4baf-8b68-cc86d5265fa3/The%20Inter-state%20Migrant%20Workmen%20%28Regulation%20of%20Employment%20and%20Cond%20English.pdf
"The Jute Manufactures Cess Act, 1983 (28 of 1983) English.pdf","The Jute Manufactures Cess Act, 1983",https://storage.googleapis.com/jugalbandi/generic_qa/cc5d8a62-8fa7-4baf-8b68-cc86d5265fa3/The%20Jute%20Manufactures%20Cess%20Act%2C%201983%20%2828%20of%201983%29%20English.pdf
The Juvenile Justice (Care and protection of children) Act 2000 Eng.pdf,"The Juvenile Justice (Care and protection of children) Act, 2000",https://storage.googleapis.com/jugalbandi/generic_qa/cc5d8a62-8fa7-4baf-8b68-cc86d5265fa3/The%20Juvenile%20Justice%20%28Care%20and%20protection%20of%20children%29%20Act%202000%20Eng.pdf
"The Lalit Kala Academi (Taking over of Management) Act, 1997 Eng.pdf","The Lalit Kala Acadami (Taking over of Management) Act, 1997",https://storage.googleapis.com/jugalbandi/generic_qa/cc5d8a62-8fa7-4baf-8b68-cc86d5265fa3/The%20Lalit%20Kala%20Academi%20%28Taking%20over%20of%20Management%29%20Act%2C%201997%20Eng.pdf
"The Leaders and Chief Whips of Recognised Parties and Groups in Parliament (Facilities) Act, 1998 English.pdf","The Leaders and Chief Whips of Recognised Parties and Groups in Parliament (Facilities) Act, 1998",https://storage.googleapis.com/jugalbandi/generic_qa/cc5d8a62-8fa7-4baf-8b68-cc86d5265fa3/The%20Leaders%20and%20Chief%20Whips%20of%20Recognised%20Parties%20and%20Groups%20in%20Parliament%20%28Facilities%29%20Act%2C%201998%20English.pdf
"The Live-stock Importation Act, 1898 English.pdf","The Live-stock Importation Act, 1898",https://storage.googleapis.com/jugalbandi/generic_qa/cc5d8a62-8fa7-4baf-8b68-cc86d5265fa3/The%20Live-stock%20Importation%20Act%2C%201898%20English.pdf
"The Lotteries (Regulation) Act, 1998 English.pdf","The Lotteries (Regulation) Act, 1998",https://storage.googleapis.com/jugalbandi/generic_qa/cc5d8a62-8fa7-4baf-8b68-cc86d5265fa3/The%20Lotteries%20%28Regulation%29%20Act%2C%201998%20English.pdf
The Mahatma Gandhi Rural employment guarantee Act 2005 English.pdf,"The Mahatma Gandhi Rural employment guarantee Act, 2005",https://storage.googleapis.com/jugalbandi/generic_qa/cc5d8a62-8fa7-4baf-8b68-cc86d5265fa3/The%20Mahatma%20Gandhi%20Rural%20employment%20guarantee%20Act%202005%20English.pdf
"The Maintenance of Welfare of Parents and Senior Citizens Act, 2007 English.pdf","The Maintenance of Welfare of Parents and Senior Citizens Act, 2007",https://storage.googleapis.com/jugalbandi/generic_qa/cc5d8a62-8fa7-4baf-8b68-cc86d5265fa3/The%20Maintenance%20of%20Welfare%20of%20Parents%20and%20Senior%20Citizens%20Act%2C%202007%20English.pdf
"The Mental Health Act, 1987 Eng.pdf","The Mental Health Act, 1987",https://storage.googleapis.com/jugalbandi/generic_qa/cc5d8a62-8fa7-4baf-8b68-cc86d5265fa3/The%20Mental%20Health%20Act%2C%201987%20Eng.pdf
"The Motor Vehicles Act, 1988 English.pdf","The Motor Vehicles Act, 1988",https://storage.googleapis.com/jugalbandi/generic_qa/cc5d8a62-8fa7-4baf-8b68-cc86d5265fa3/The%20Motor%20Vehicles%20Act%2C%201988%20English.pdf
"The Multi-State Co-Operative Societies Act, 2002 English.pdf","The Multi-State Co-Operative Societies Act, 2002",https://storage.googleapis.com/jugalbandi/generic_qa/cc5d8a62-8fa7-4baf-8b68-cc86d5265fa3/The%20Multi-State%20Co-Operative%20Societies%20Act%2C%202002%20English.pdf
"The Muslim Women (Protection of Rights on Divorce) Act, 1986 English.pdf","The Muslim Women (Protection of Rights on Divorce) Act, 1986",https://storage.googleapis.com/jugalbandi/generic_qa/cc5d8a62-8fa7-4baf-8b68-cc86d5265fa3/The%20Muslim%20Women%20%28Protection%20of%20Rights%20on%20Divorce%29%20Act%2C%201986%20English.pdf
"The Muslim Women (Protection of Rights on Marriage) Act, 2019 English.pdf","The Muslim Women (Protection of Rights on Marriage) Act, 2019",https://storage.googleapis.com/jugalbandi/generic_qa/cc5d8a62-8fa7-4baf-8b68-cc86d5265fa3/The%20Muslim%20Women%20%28Protection%20of%20Rights%20on%20Marriage%29%20Act%2C%202019%20English.pdf
"The National Airports Authority Act, 1985 Eng.pdf","The National Airports Authority Act, 1985",https://storage.googleapis.com/jugalbandi/generic_qa/cc5d8a62-8fa7-4baf-8b68-cc86d5265fa3/The%20National%20Airports%20Authority%20Act%2C%201985%20Eng.pdf
"The National Bank For Agriculture And Rural Development Act, 1981 English.pdf","The National Bank For Agriculture And Rural Development Act, 1981",https://storage.googleapis.com/jugalbandi/generic_qa/cc5d8a62-8fa7-4baf-8b68-cc86d5265fa3/The%20National%20Bank%20For%20Agriculture%20And%20Rural%20Development%20Act%2C%201981%20English.pdf
"The National Cadet Corps Act, 1948 English.pdf","The National Cadet Corps Act, 1948",https://storage.googleapis.com/jugalbandi/generic_qa/cc5d8a62-8fa7-4baf-8b68-cc86d5265fa3/The%20National%20Cadet%20Corps%20Act%2C%201948%20English.pdf
"The National Commission For Women Act, 1990 English.pdf","The National Commission For Women Act, 1990",https://storage.googleapis.com/jugalbandi/generic_qa/cc5d8a62-8fa7-4baf-8b68-cc86d5265fa3/The%20National%20Commission%20For%20Women%20Act%2C%201990%20English.pdf
"The National Commission for Backward Classes Act, 1993 Eng.pdf","The National Commission for Backward Classes Act, 1993",https://storage.googleapis.com/jugalbandi/generic_qa/cc5d8a62-8fa7-4baf-8b68-cc86d5265fa3/The%20National%20Commission%20for%20Backward%20Classes%20Act%2C%201993%20Eng.pdf
"The National Commission for Minorities Act, 1992 English.pdf","The National Commission for Minorities Act, 1992",https://storage.googleapis.com/jugalbandi/generic_qa/cc5d8a62-8fa7-4baf-8b68-cc86d5265fa3/The%20National%20Commission%20for%20Minorities%20Act%2C%201992%20English.pdf
"The National Commission for Safai Karmacharis Act, 1993 English.pdf","The National Commission for Safai Karmacharis Act, 1993",https://storage.googleapis.com/jugalbandi/generic_qa/cc5d8a62-8fa7-4baf-8b68-cc86d5265fa3/The%20National%20Commission%20for%20Safai%20Karmacharis%20Act%2C%201993%20English.pdf
"The National Dairy Development Board Act, 1987 English.pdf","The National Dairy Development Board Act, 1987",https://storage.googleapis.com/jugalbandi/generic_qa/cc5d8a62-8fa7-4baf-8b68-cc86d5265fa3/The%20National%20Dairy%20Development%20Board%20Act%2C%201987%20English.pdf
"The National Environment Appellate Authority Act, 1997 Eng.pdf","The National Environment Appellate Authority Act, 1997",https://storage.googleapis.com/jugalbandi/generic_qa/cc5d8a62-8fa7-4baf-8b68-cc86d5265fa3/The%20National%20Environment%20Appellate%20Authority%20Act%2C%201997%20Eng.pdf
"The National Food Security Act, 2013 English.pdf","The National Food Security Act, 2013",https://storage.googleapis.com/jugalbandi/generic_qa/cc5d8a62-8fa7-4baf-8b68-cc86d5265fa3/The%20National%20Food%20Security%20Act%2C%202013%20English.pdf
"The National Housing Bank Act, 1987 English.pdf","The National Housing Bank Act, 1987",https://storage.googleapis.com/jugalbandi/generic_qa/cc5d8a62-8fa7-4baf-8b68-cc86d5265fa3/The%20National%20Housing%20Bank%20Act%2C%201987%20English.pdf
"The National Institute of Pharmaceutical Education and Research Act, 1998 English.pdf","The National Institute of Pharmaceutical Education and Research Act, 1998",https://storage.googleapis.com/jugalbandi/generic_qa/cc5d8a62-8fa7-4baf-8b68-cc86d5265fa3/The%20National%20Institute%20of%20Pharmaceutical%20Education%20and%20Research%20Act%2C%201998%20English.pdf
